title,date,url
"India, China Strike Out in Talks to Ease Border Dispute ",2021-10-11,https://www.wsj.com/articles/india-china-strike-out-in-talks-to-ease-border-dispute-11633962853
"In Israel, Younger People Aren’t Convinced by Covid Booster Shots ",2021-10-10,https://www.wsj.com/articles/covid-19-booster-shots-are-available-for-all-in-israel-younger-people-arent-convinced-11633858202
Jon Gruden Used Racial Trope to Describe NFLPA Chief DeMaurice Smith in 2011 Email,2021-10-09,https://www.wsj.com/articles/jon-gruden-email-demaurice-smith-11633721045
The Future of Movie Theaters Is More Than Just Movies,2021-10-08,https://www.wsj.com/articles/the-future-of-movie-theaters-is-more-than-just-movies-11633708800
Saudi-Led Group Acquires Newcastle in the English Premier League,2021-10-07,https://www.wsj.com/articles/saudi-arabia-newcastle-english-premier-league-11633614078
Who Is Kyrsten Sinema? It’s Complicated,2021-10-06,https://www.wsj.com/articles/kyrsten-sinema-socialist-free-thought-bipartisan-reconciliation-progressives-moderate-11633527965
Apple Pay Fees Vex Credit-Card Issuers,2021-10-05,https://www.wsj.com/articles/apple-pay-fees-vex-credit-card-issuers-11633449317
Activist Investor Engine No. 1 Backs GM’s Electric-Vehicle Push,2021-10-04,https://www.wsj.com/articles/activist-investor-engine-no-1-says-it-backs-gm-s-electric-vehicle-push-11633355636
Big Hasn't Been the Best for Fund Investors,2021-10-03,https://www.wsj.com/articles/top-stock-fund-manager-11633193956
"Kavanaugh Tests Positive for Covid-19, Has No Symptoms ",2021-10-02,https://www.wsj.com/articles/justice-brett-kavanaugh-tests-positive-for-covid-19-has-no-symptoms-11633094178
Justice Department Firms Up Criminal Division Leadership Ranks ,2021-10-01,https://www.wsj.com/articles/justice-department-firms-up-criminal-division-leadership-ranks-11633112472
Biden’s Energy Price Shock,2021-09-30,https://www.wsj.com/articles/joe-bidens-energy-price-shock-oil-gas-opec-shortage-11632950693
Are Charm Necklaces the New Ties? ,2021-09-29,https://www.wsj.com/articles/are-charm-necklaces-the-new-ties-11632931831
Havana Syndrome Attacks Widen,2021-09-28,https://www.wsj.com/articles/havana-syndrome-attacks-widen-as-cia-officer-is-evacuated-from-serbia-11632844044
A Closer Look,2021-09-27,https://www.wsj.com/articles/a-closer-look-11632763579
Three Dead After Amtrak Train Derails in Montana,2021-09-26,https://www.wsj.com/articles/amtrak-train-derailment-in-montana-leaves-multiple-people-injured-11632623352
The 417-Yard Drive That Explains the Americans’ Lead at the Ryder Cup,2021-09-25,https://www.wsj.com/articles/ryder-cup-2021-scores-bryson-dechambeau-417-yard-drive-11632528481
Ryder Cup on Course With Tech Overhaul,2021-09-24,https://www.wsj.com/articles/ryder-cup-on-course-with-tech-overhaul-11632504625
Salesforce Boosts Sales Outlook,2021-09-23,https://www.wsj.com/articles/salesforce-boosts-sales-outlook-as-covid-19-continues-to-lift-demand-11632414020
Biden’s Strategy on Haitian Migrants in Texas Sparks Bipartisan Criticism,2021-09-22,https://www.wsj.com/articles/bidens-strategy-on-haitian-migrants-in-texas-sparks-bipartisan-blowback-11632329430
Conoco Kicks Off Oil Industry’s Carbon Shell Game ,2021-09-21,https://www.wsj.com/articles/conoco-kicks-off-oil-industrys-carbon-shell-game-11632244220
Xi Jinping Aims to Rein In Chinese Capitalism,2021-09-20,https://www.wsj.com/articles/xi-jinping-aims-to-rein-in-chinese-capitalism-hew-to-maos-socialist-vision-11632150725
SpaceX Returns Private Astronauts to Earth After Three Days in Orbit ,2021-09-19,https://www.wsj.com/articles/spacex-returns-private-astronauts-to-earth-after-three-days-in-orbit-11632006524
"Wynn Resorts, Kroger, Robinhood: Stocks That Defined the Week",2021-09-18,https://www.wsj.com/articles/wynn-resorts-kroger-robinhood-stocks-that-defined-the-week-11631923356
Former Victoria’s Secret Angel Karolina Kurkova Lists Tribeca Pad for $4.7 Million,2021-09-17,https://www.wsj.com/articles/karolina-kurkova-lists-tribeca-apartment-11631898032
‘The Flight Attendant’ Star Kaley Cuoco Actually Hates Flying,2021-09-16,https://www.wsj.com/articles/the-flight-attendant-star-kaley-cuoco-actually-hates-flying-11631811600
Scenic St. Andrews,2021-09-15,https://www.wsj.com/articles/scenic-st-andrews-11631731929
U.K. Bets on Covid-19 Booster Shots to Avoid Winter Lockdowns,2021-09-14,https://www.wsj.com/articles/u-k-bets-on-covid-19-booster-shots-to-avoid-winter-lockdowns-11631640575
Iran Says It Will Resume Nuclear Talks in the Near Future,2021-09-13,https://www.wsj.com/articles/iran-says-it-will-resume-nuclear-talks-in-the-near-future-11631553747
FBI Makes Public Memo on 9/11 Probe ,2021-09-12,https://www.wsj.com/articles/fbi-makes-public-long-secret-memo-on-9-11-investigation-11631414499
Senators Seek Investigation of Amazon’s Treatment of Pregnant Workers,2021-09-11,https://www.wsj.com/articles/senators-seek-investigation-of-amazon-over-treatment-of-pregnant-workers-11631294571
Grocery Store CEO Wants More Food Stamps,2021-09-10,https://www.wsj.com/articles/food-stamps-snap-benefits-safety-net-iga-grocery-11631225177
A Closer Look,2021-09-09,https://www.wsj.com/articles/a-closer-look-11631217740
Tampa Bay Buccaneers Co-Owner Wants $55 Million for Palm Beach Property,2021-09-08,https://www.wsj.com/articles/tampa-bay-buccaneers-co-owner-wants-55-million-for-palm-beach-property-11631127526
These Sensor-Studded Smart Clothes Just Might Save Your Life,2021-09-07,https://www.wsj.com/articles/these-sensor-studded-smart-clothes-just-might-save-your-life-11631030505
Big Boeing Customer Says It Is Walking Away From New MAX Order ,2021-09-06,https://www.wsj.com/articles/big-boeing-customer-says-it-is-walking-away-from-new-max-order-11630933735
Child Covid Cases Rise in States Where Schools Opened Earliest ,2021-09-05,https://www.wsj.com/articles/child-covid-19-cases-rise-in-states-where-schools-opened-earliest-11630834201
"Lyft, Uber to Cover Legal Costs of Drivers Sued Under Texas Abortion Law",2021-09-04,https://www.wsj.com/articles/lyft-to-cover-legal-costs-of-drivers-sued-under-texas-abortion-law-11630700449
Poppy Seed Recipes: Sprinkle on Some Glamour,2021-09-03,https://www.wsj.com/articles/poppy-seed-recipes-sprinkle-on-some-glamour-11630684748
"Bernie, Bluto and the ‘Animal House’ Democrats",2021-09-02,https://www.wsj.com/articles/bernie-sanders-democrats-spending-government-trillion-infrastructure-debt-11630529717
Hurricane Ida Destroyed This Town. Residents Hope Help Arrives Soon.,2021-09-01,https://www.wsj.com/articles/hurricane-ida-destroyed-this-town-residents-hope-help-arrives-soon-11630520241
Medicare Advantage Savings Come at a Cost,2021-08-31,https://www.wsj.com/articles/medicare-advantage-savings-cost-hmo-healthcare-11630360959
Disney Held Unsuccessful Mediation Talks With Alleged Sexual-Assault Victims,2021-08-30,https://www.wsj.com/articles/disney-held-unsuccessful-mediation-talks-with-alleged-sexual-assault-victims-11630330552
Biden Warns Another Attack in Afghanistan Likely as U.S. Begins Final Stage of Withdrawal ,2021-08-29,https://www.wsj.com/articles/u-s-begins-final-stages-of-afghan-withdrawal-11630149628
U.S. Holds Talks With Taliban Over Post-Aug. 31 Presence,2021-08-28,https://www.wsj.com/articles/europe-scrambles-to-avoid-migrant-crisis-rerun-as-afghans-are-resettled-11630079258
Cristiano Ronaldo Returns to Manchester United,2021-08-27,https://www.wsj.com/articles/cristiano-ronaldo-manchester-united-juventus-messi-11630083733
The Customized Car Is Back,2021-08-26,https://www.wsj.com/articles/ford-custom-car-order-dealership-11629928509
Steven Koonin Is a Must-Read on Climate Change,2021-08-25,https://www.wsj.com/articles/steven-koonin-climate-change-global-warming-book-11629841265
The High Price of Federal Marijuana Legalization,2021-08-24,https://www.wsj.com/articles/schumer-federal-marijuana-cannabis-thc-synthetic-vape-edible-legalize-youth-drug-use-11629821434
Boeing Plans Investment in Virgin Orbit’s $3.2 Billion SPAC Listing,2021-08-23,https://www.wsj.com/articles/boeing-plans-investment-in-virgin-orbits-3-2-billion-spac-listing-11629713303
Taliban Battles Militia in First Significant Clashes Since Takeover,2021-08-22,https://www.wsj.com/articles/anti-taliban-militia-battles-afghan-islamist-group-in-first-significant-clashes-since-takeover-11629560781
‘The Taliban Are Here’: The Final Days Before Kabul’s Collapse,2021-08-21,https://www.wsj.com/articles/the-taliban-are-here-the-final-days-before-kabuls-collapse-11629505499
Woodcock Ruled Out for Top FDA Job,2021-08-20,https://www.wsj.com/articles/janet-woodcock-ruled-out-for-top-fda-job-sources-say-11629476487
"Is Your Oven Stuck on 350 Degrees? It’s Not Broken, It’s in Sabbath Mode. ",2021-08-19,https://www.wsj.com/articles/is-your-oven-stuck-on-350-degrees-its-not-broken-its-in-sabbath-mode-11629401988
What to Watch: Four Shows to Stream This Week,2021-08-18,https://www.wsj.com/articles/what-to-watch-four-shows-to-stream-this-week-11629313201
Photos: Taliban Take Over Kabul After Sweeping Afghanistan,2021-08-17,https://www.wsj.com/articles/afghans-flee-to-kabul-as-taliban-advances-11628898416
How Tight Is Too Tight? Why ‘Bachelorette’ Stars and Gym Rats Wear Ultra-Slim Suits,2021-08-16,https://www.wsj.com/articles/how-tight-is-too-tight-why-bachelorette-stars-and-gym-rats-wear-ultra-slim-suits-11629127144
Why Many Millennials Fall Prey to Impostor Syndrome,2021-08-15,https://www.wsj.com/articles/imposter-syndrome-young-adults-11619819337
Judge Investigating Assassination of Haiti’s President Steps Down,2021-08-14,https://www.wsj.com/articles/haiti-legal-clerk-investigating-presidents-murder-is-killed-11628868830
Weak Oversight Plagues Audits of Billions in Private Assets,2021-08-13,https://www.wsj.com/articles/weak-oversight-plagues-audits-of-billions-in-private-assets-11628847000
"What to Know About Breakthrough Infections, Cases and Symptoms ",2021-08-12,https://www.wsj.com/articles/breakthrough-cases-covid-19-delta-variant-11627596643
Biden Bails Out Amtrak,2021-08-11,https://www.wsj.com/articles/biden-amtrak-bailout-11628631921
"Dominion Sues Newsmax, Others Over Election Claims ",2021-08-10,https://www.wsj.com/articles/dominion-sues-newsmax-one-america-news-network-others-over-election-claims-11628599768
In Their Own Words With XPV Water Partners’ David Henderson,2021-08-09,https://www.wsj.com/articles/in-their-own-words-with-xpv-water-partners-david-henderson-11628522871
Record Pace for Corporate Earnings Keeps Stocks Buoyant,2021-08-08,https://www.wsj.com/articles/record-pace-for-corporate-earnings-keeps-stocks-buoyant-11628415002
Cheddar Brownies,2021-08-07,https://www.wsj.com/articles/cheddar-brownies-11628295901
Producer Marcia Nasatir Broke Into Hollywood’s Boys’ Club,2021-08-06,https://www.wsj.com/articles/producer-marcia-nasatir-broke-into-hollywoods-boys-club-11628270837
The Fed’s Reverse Repos Don’t Shrink the Money Supply,2021-08-05,https://www.wsj.com/articles/fed-reverse-repos-m2-money-supply-inflation-11628113168
China’s ‘State Capitalism’ Is Not Capitalism,2021-08-04,https://www.wsj.com/articles/china-ccp-firms-foreign-investors-state-capitalism-11628028172
Hawaii’s Treasured Time-Warp Hotels ,2021-08-03,https://www.wsj.com/articles/hawaiis-treasured-time-warp-hotels-11628009322
Death Toll From China Flood Jumps to More Than 300 ,2021-08-02,https://www.wsj.com/articles/death-toll-from-china-flood-jumps-to-more-than-300-11627909724
Fired Executive Says Deutsche Bank’s DWS Overstated Sustainable-Investing Efforts,2021-08-01,https://www.wsj.com/articles/fired-executive-says-deutsche-banks-dws-overstated-sustainable-investing-efforts-11627810380
Former Colombian Soldiers Deny Killing Haitian President ,2021-07-31,https://www.wsj.com/articles/former-colombian-soldiers-deny-killing-haitian-president-11627692209
Why Employees Prefer to Be Tracked by Machines Rather Than Humans ,2021-07-30,https://www.wsj.com/articles/why-employees-prefer-to-be-tracked-by-machines-rather-than-humans-11627664400
‘Revisiting America: The Prints of Currier and Ives’ Review: Framing History,2021-07-29,https://www.wsj.com/articles/currier-and-ives-american-history-prints-lithographs-11627504246
The Difference Between a Comedian and a Comic,2021-07-28,https://www.wsj.com/articles/jerry-lewis-funny-comedian-comic-11627422972
"China Appears to Be Building New Silos for Nuclear Missiles, Researchers Say",2021-07-27,https://www.wsj.com/articles/china-appears-to-be-building-new-silos-for-nuclear-missiles-researchers-say-11627401364
Detroit Bumbles Over 12 Million Imported Bees,2021-07-26,https://www.wsj.com/articles/bees-beekeeping-detroit-buzz-11627309457
Investors Are Buying American,2021-07-25,https://www.wsj.com/articles/investors-are-buying-american-11627205402
Biden Campaigns in Virginia in Preview of Democrats’ 2022 Strategy,2021-07-24,https://www.wsj.com/articles/biden-to-campaign-in-virginia-in-preview-of-democrats-2022-strategy-11627041630
Grilled Summer-Squash Pizza With Ricotta and Zucchini Blossoms,2021-07-23,https://www.wsj.com/articles/grilled-summer-squash-pizza-with-ricotta-and-zucchini-blossoms-11627057188
"Palm Beach Real Estate Is So Hot, at Least 22 Homes Have Sold for $40 Million-Plus Since Covid",2021-07-22,https://www.wsj.com/articles/palm-beach-florida-real-estate-housing-market-11626972941
British Man Arrested on Charges Stemming From 2020 Twitter Hack,2021-07-21,https://www.wsj.com/articles/british-man-arrested-on-charges-stemming-from-last-years-twitter-hack-11626885106
"Too Many Meetings? It May Get Better, Or Not.",2021-07-20,https://www.wsj.com/articles/too-many-meetings-it-may-get-better-or-not-11626799531
Exxon Turns to Company Outsider to Fill CFO Role,2021-07-19,https://www.wsj.com/articles/exxon-mobil-names-kathryn-mikells-cfo-11626705506
First Covid-19 Infections Among Athletes in Olympic Village Are Confirmed,2021-07-18,https://www.wsj.com/articles/first-covid-19-infections-among-athletes-in-olympic-village-are-confirmed-11626581622
Portillo’s Aims to Go Public This Year ,2021-07-17,https://www.wsj.com/articles/portillos-aims-to-go-public-this-year-11626441797
Goldbelly’s Joe Ariel Is Bringing Foodies and Restaurants Together,2021-07-16,https://www.wsj.com/articles/goldbellys-joe-ariel-is-bringing-foodies-and-restaurants-together-11626452717
Some Haiti Assassination Suspects Once Received U.S. Training,2021-07-15,https://www.wsj.com/articles/haiti-assassination-suspects-once-received-u-s-training-pentagon-says-11626373632
Biden Turns Back the Progressive Clock,2021-07-14,https://www.wsj.com/articles/biden-turns-back-the-progressive-clock-11626286594
Budget Deficit Narrowed in First Nine Months of Fiscal Year,2021-07-13,https://www.wsj.com/articles/u-s-budget-deficit-narrowed-to-2-2-trillion-in-first-nine-months-of-fiscal-year-11626199200
Huawei Settles Two Patent Lawsuits It Filed Against Verizon ,2021-07-12,https://www.wsj.com/articles/huawei-settles-two-patent-lawsuits-it-filed-against-verizon-11626105146
The Seemingly Unstoppable Grand Slam Summer of Novak Djokovic,2021-07-11,https://www.wsj.com/articles/novak-djokovic-wimbledon-grand-slam-us-open-tokyo-golden-slam-11626025131
Biden Ousts Social Security Chief ,2021-07-10,https://www.wsj.com/articles/biden-ousts-social-security-chief-11625871710
Klarna Buys Online Commerce Startup Hero ,2021-07-09,https://www.wsj.com/articles/klarna-buys-online-commerce-startup-hero-11625849576
Netflix Signs ‘Bridgerton’ Producer Shonda Rhimes to New Deal,2021-07-08,https://www.wsj.com/articles/netflix-signs-bridgerton-producer-shonda-rhimes-to-new-deal-11625763884
Fintech Wise Makes Strong Debut in London,2021-07-07,https://www.wsj.com/articles/u-k-fintech-wise-makes-strong-debut-in-london-direct-listing-11625654582
The Pizza Delivery Guy Will Be a Robot at Many Campuses This Fall ,2021-07-06,https://www.wsj.com/articles/grubhub-to-use-food-delivering-robots-on-college-campuses-11625591000
Didi and the Big Chill on China’s Big Data ,2021-07-05,https://www.wsj.com/articles/didi-and-the-big-chill-on-chinas-big-data-11625479452
Demolition of Collapsed Building to Start as Soon as Sunday,2021-07-04,https://www.wsj.com/articles/miami-area-condo-collapse-building-demolition-to-start-sunday-11625329080
What Post-CEO Life Looks Like if You’re Jeff Bezos,2021-07-03,https://www.wsj.com/articles/what-post-ceo-life-looks-like-if-youre-jeff-bezos-11625218231
What to Read This Week,2021-07-02,https://www.wsj.com/articles/what-to-read-this-week-11625246759
"Wells Fargo Acted Like a ‘Mafia’ to Suppress Internal Critics, Former Executive Said ",2021-07-01,https://www.wsj.com/articles/wells-fargo-acted-like-a-mafia-to-suppress-internal-critics-former-executive-said-11625169200
Smaller Is Bigger for Payments Giants ,2021-06-30,https://www.wsj.com/articles/smaller-is-bigger-for-payments-giants-11625078897
U.S. Commander in Afghanistan Warns of Civil-War Risk as Security Deteriorates,2021-06-29,https://www.wsj.com/articles/u-s-commander-in-afghanistan-says-security-deteriorating-as-troops-close-in-on-complete-pullout-11624984624
Panama Canal Tackles Climate-Change Puzzle,2021-06-28,https://www.wsj.com/articles/panama-canal-tackles-climate-change-puzzle-too-little-rainwater-or-too-much-11624872601
First U.S. Cruise Since Covid Set Sail. Here’s What You Need to Know About Cruises. ,2021-06-27,https://www.wsj.com/articles/cruises-and-covid-19-when-u-s-sailings-could-restart-and-what-safety-precautions-are-expected-11607941801
Biden Signs Law Creating Memorial at Nightclub Shooting Site ,2021-06-26,https://www.wsj.com/articles/biden-signs-law-creating-pulse-memorial-at-nightclub-shooting-site-11624665332
Remote Learning Threatens the $670 Billion College-Industrial Complex,2021-06-25,https://www.wsj.com/articles/the-670-billion-college-industrial-complex-is-under-threat-from-online-school-11624636809
Numbers Ain’t What They Used to Be in Turbulent Economy ,2021-06-24,https://www.wsj.com/articles/numbers-aint-what-they-used-to-be-in-turbulent-u-s-economy-11624557962
"For $75 Million, a Beachfront Mansion on a Storied Southampton Lane",2021-06-23,https://www.wsj.com/articles/for-75-million-a-beachfront-mansion-on-southamptons-storied-meadow-lane-11624464424
Why Helen Hunt Wasn’t Initially Mad About ‘Mad About You’,2021-06-22,https://www.wsj.com/articles/why-helen-hunt-wasnt-initially-mad-about-mad-about-you-11624377637
"After Decades of Control, the NCAA Finds Itself ‘On Its Heels’",2021-06-21,https://www.wsj.com/articles/after-decades-of-control-the-ncaa-finds-itself-on-its-heels-11624297833
Natural-Gas Prices Are Rising With Temperatures,2021-06-20,https://www.wsj.com/articles/the-natural-gas-glut-has-evaporated-driving-prices-higher-11624134728
"Investor, Trader, Speculator: Which One Are You?",2021-06-19,https://www.wsj.com/articles/you-cant-invest-without-trading-you-can-trade-without-investing-11623426213
Shame if U.S. Abandons Afghan Translators,2021-06-18,https://www.wsj.com/articles/shame-if-u-s-abandons-afghan-translators-11624033339
"A Sail of Two Cities (Friday Crossword, June 18)",2021-06-17,https://www.wsj.com/articles/a-sail-of-two-cities-friday-crossword-june-18-11623767309
"An Olympian, a Failed Drug Test and an Accused Burrito",2021-06-16,https://www.wsj.com/articles/olympic-runner-failed-drug-test-burrito-shelby-houlihan-11623867500
"Aspen Mansion Sells for $72.5 Million, Setting Record for the Tony Colorado Town",2021-06-15,https://www.wsj.com/articles/aspen-mansion-sells-for-record-breaking-72-5-million-11623782345
"Jeffrey Toobin, the ‘1619 Project’ and the Journalistic Reign of Error",2021-06-14,https://www.wsj.com/articles/jeffrey-toobin-the-1619-project-and-the-journalistic-reign-of-error-11623689253
National Parks Are Overcrowded and Closing Their Gates ,2021-06-13,https://www.wsj.com/articles/national-parks-are-overcrowded-and-closing-their-gates-11623582002
"Apple Subpoenas Prompt Internal Review, Calls for Barr, Sessions to Testify",2021-06-12,https://www.wsj.com/articles/democratic-senators-call-for-ex-attorneys-general-barr-sessions-to-testify-11623427825
"Pulitzer Prizes Highlight Coverage Related to Floyd Killing, Covid-19 ",2021-06-11,https://www.wsj.com/articles/pulitzer-prizes-highlight-coverage-related-to-george-floyd-killing-covid-19-11623436044
Tax-Exempt Group Favors Higher Rates on Taxpayers,2021-06-10,https://www.wsj.com/articles/tax-exempt-group-favors-higher-rates-on-taxpayers-11623355049
Apple’s Moves to Tighten Flow of User Data Leave Advertisers Anxious ,2021-06-09,https://www.wsj.com/articles/apples-moves-to-tighten-flow-of-user-data-leave-advertisers-anxious-11623189903
U.S. Trade Deficit Narrowed in April,2021-06-08,https://www.wsj.com/articles/u-s-trade-deficit-narrowed-in-april-11623156196
Supreme Court Says Protected Noncitizens Who Entered U.S. Unlawfully Can’t Get Green Cards,2021-06-07,https://www.wsj.com/articles/supreme-court-says-protected-noncitizens-who-entered-u-s-unlawfully-cant-get-green-cards-11623087465
"Trump Criticizes Biden Policies, Calls for Covid-19 Reparations From China ",2021-06-06,https://www.wsj.com/articles/trump-criticizes-biden-policies-calls-for-reparations-from-china-for-covid-19-11622948284
U.S. Government Bond Yields Slip After Jobs Data,2021-06-05,https://www.wsj.com/articles/u-s-government-bond-yields-slip-after-jobs-data-11622821509
China Reports First Human Case of H10N3 Bird-Flu Strain,2021-06-04,https://www.wsj.com/articles/what-is-going-on-with-bird-flu-china-reports-first-human-case-of-h10n3-strain-11622658667
U.S. to Share Bulk of Donated Covid-19 Vaccines Through Covax ,2021-06-03,https://www.wsj.com/articles/u-s-to-share-bulk-of-donated-covid-19-vaccine-doses-through-covax-program-11622734211
"Profits May Not Be So Seamless for DoorDash, Uber Eats ",2021-06-02,https://www.wsj.com/articles/profits-may-not-be-so-seamless-for-doordash-uber-eats-11622659986
Has Biden Lost His Nerve With Putin?,2021-06-01,https://www.wsj.com/articles/has-biden-lost-his-nerve-with-putin-11622566741
How to Know When Inflation Is Here to Stay,2021-05-31,https://www.wsj.com/articles/how-to-know-when-inflation-is-here-to-stay-11622447259
Overdraft Fees Fell in the Covid-19 Economy ,2021-05-30,https://www.wsj.com/articles/overdraft-fees-fell-in-the-covid-19-economy-11622367000
"Newmark’s New CIO Looks to Streamline Systems, Digitize More Operations",2021-05-29,https://www.wsj.com/articles/newmarks-new-cio-looks-to-streamline-systems-and-digitize-more-operations-11622246629
Bitcoin Mining Operation Uncovered During U.K. Drug Bust ,2021-05-28,https://www.wsj.com/articles/bitcoin-mining-operation-is-uncovered-during-u-k-drug-bust-11622219458
Whitmer Was Right to Shut Pipeline Down ,2021-05-27,https://www.wsj.com/articles/gov-whitmer-was-right-to-shut-pipeline-down-11622142526
This Austin Home Looks Like a Traditional Craftsman. The Back of It Is Anything But.,2021-05-26,https://www.wsj.com/articles/this-austin-home-looks-like-a-traditional-craftsman-the-back-of-it-is-anything-but-11622055619
"Moderna’s Covid-19 Vaccine Works Safely in Adolescents, Company Says",2021-05-25,https://www.wsj.com/articles/modernas-covid-19-vaccine-works-safely-in-adolescents-company-says-11621944002
The Consequences of Not Creating a Jan. 6 Commission,2021-05-24,https://www.wsj.com/articles/the-consequences-of-not-creating-a-jan-6-commission-11621861473
Volcano Eruption Forces Thousands to Evacuate in Eastern Congo ,2021-05-23,https://www.wsj.com/articles/volcano-eruption-forces-thousands-to-evacuate-in-eastern-congo-11621766797
Biden Rules Out Justice Department Access to Journalists’ Phone Records ,2021-05-22,https://www.wsj.com/articles/biden-rules-out-justice-department-access-to-journalists-phone-records-11621639951
Getting More People Vaccinated Against Covid-19 Means Wasting Doses,2021-05-21,https://www.wsj.com/articles/getting-more-people-vaccinated-against-covid-19-means-wasting-doses-11621594802
"Feds Hurt Fannie, Freddie’s Capitalization",2021-05-20,https://www.wsj.com/articles/feds-hurt-fannie-freddies-capitalization-11621534995
U.K. Polluters Face Higher Costs as Breakaway Carbon Market Goes Live ,2021-05-19,https://www.wsj.com/articles/u-k-polluters-face-higher-costs-as-breakaway-carbon-market-goes-live-11621425610
"Home Depot Sales Surge, Extending Growth During Pandemic",2021-05-18,https://www.wsj.com/articles/home-depot-sales-surge-extending-growth-during-pandemic-11621335766
More Covid-19 Hospital Patients Are Younger ,2021-05-17,https://www.wsj.com/articles/covid-19-hospital-patients-tend-to-be-younger-now-11621271313
Conflict in Middle East Draws Biden Call to Temper Hostilities,2021-05-16,https://www.wsj.com/articles/israel-faces-intensified-rocket-fire-from-hamas-continues-gaza-bombardment-11621085034
Bipartisan Deal Struck on Jan. 6 Capitol Riot Probe ,2021-05-15,https://www.wsj.com/articles/bipartisan-deal-struck-on-jan-6-capitol-riot-probe-11621004260
Top Colleges in the West by Size,2021-05-14,https://www.wsj.com/articles/top-colleges-in-the-west-by-size-11619629861
"Modi Declared Victory, Then Covid Struck Back With a Vengeance",2021-05-13,https://www.wsj.com/articles/modi-declared-victory-then-covid-struck-back-with-a-vengeance-11620922164
Airplane Thrillers Take Off This Summer,2021-05-12,https://www.wsj.com/articles/rules-for-thrillers-set-on-airplanes-11620828058
18 Résumé Writing Tips to Get You Noticed,2021-05-11,https://www.wsj.com/articles/18-resume-writing-tips-to-get-you-noticed-11605107446
"Tyson Adds Workers, Breeds Bigger Flocks as Chicken Demand Soars",2021-05-10,https://www.wsj.com/articles/tyson-adds-workers-breeds-bigger-flocks-as-chicken-demand-soars-11620666854
Some Startups Went From Rescue PPP Loans to SPAC Windfalls ,2021-05-09,https://www.wsj.com/articles/some-startups-went-from-rescue-ppp-loans-to-spac-windfalls-11620561600
