title,date,url
Pepper...and Salt,2023-06-13,https://www.wsj.com/articles/pepper-and-salt-807c5dfc
What Your Barista Is Really Thinking as You Are About to Tip,2023-06-12,https://www.wsj.com/articles/what-your-barista-is-really-thinking-as-you-are-about-to-tip-3ae5fdc3
"Trump, DeSantis Bring Tailored Messages to GOP Faithful",2023-06-11,https://www.wsj.com/articles/after-indictment-trump-desantis-bring-tailored-messages-to-gop-faithful-90523ab1
Why America Isn’t Ready For the EV Takeover,2023-06-10,https://www.wsj.com/articles/tesla-gm-ford-biden-administration-ev-charging-5914f547
13 Books We Read This Week,2023-06-09,https://www.wsj.com/articles/13-books-we-read-this-week-ab4a89d7
Homicides Are Falling in Major American Cities,2023-06-08,https://www.wsj.com/articles/homicides-are-falling-in-major-american-cities-7b0bd906
Amazon Plans Ad Tier for Prime Video Streaming Service,2023-06-07,https://www.wsj.com/articles/amazon-plans-ad-tier-for-prime-video-streaming-service-8944fe51
The L.A. Dodgers Forget What Courage Looks Like,2023-06-06,https://www.wsj.com/articles/la-dodgers-sisters-nuns-anti-catholic-woke-lasorda-scully-fdaca632
Why Companies Shouldn’t Try to Catch Employees With Fake Phishing Emails,2023-06-05,https://www.wsj.com/articles/companies-should-not-try-catch-employees-fake-phishing-emails-931fdb7d
"Bearish Bets Against S&P 500 Are Surging, Despite Love for Big Tech ",2023-06-04,https://www.wsj.com/articles/bearish-bets-against-s-p-500-are-surging-despite-love-for-big-tech-506cacc
The Debt-Ceiling Deal’s Winners and Losers,2023-06-03,https://www.wsj.com/articles/debt-ceiling-limit-winners-losers-a212028d
‘American Journey’ Review: Inventing the Road Trip,2023-06-02,https://www.wsj.com/articles/american-journey-review-inventing-the-road-trip-3de70b2
Pasta e Fagioli: This Italian Bean Soup Is a Pantry-Dinner Winner,2023-06-01,https://www.wsj.com/articles/pasta-e-fagioli-recipe-italian-noodle-soup-pantry-bd8fce6f
U.S. Auto-Safety Regulators Urge Automatic Emergency Braking in Future Vehicles,2023-05-31,https://www.wsj.com/articles/u-s-auto-safety-regulators-want-to-mandate-automatic-emergency-braking-in-future-vehicles-594a5323
"Debt-Ceiling Deal Does Little to Change Direction of Federal Spending, Economy",2023-05-30,https://www.wsj.com/articles/debt-ceiling-deal-does-little-to-change-direction-of-federal-spending-economy-d613388
Why You’re Losing More to Casinos on the Las Vegas Strip,2023-05-29,https://www.wsj.com/articles/why-youre-losing-more-to-casinos-on-the-las-vegas-strip-73f6f3ab
Inmates Await Theranos Founder: ‘I Want to Be Her Friend’,2023-05-28,https://www.wsj.com/articles/elizabeth-holmes-prison-inmates-3a46a79f
Elizabeth Holmes to Report to Prison: A History of the WSJ Theranos Investigation,2023-05-27,https://www.wsj.com/articles/elizabeth-holmes-sentencing-a-history-of-the-wsj-theranos-investigation-11668741222
Can America Still Elect a Uniter Like Ronald Reagan?,2023-05-26,https://www.wsj.com/articles/can-america-still-elect-a-uniter-like-ronald-reagan-83fb539e
Target Lands in Culture-War Crosshairs Over Pride Month,2023-05-25,https://www.wsj.com/articles/target-pride-collection-culture-war-a69c7b5f
"What Is the 14th Amendment, and Can Biden Use It to Fix the Debt Ceiling?",2023-05-24,https://www.wsj.com/articles/what-is-the-14th-amendment-and-can-biden-use-it-to-fix-the-debt-ceiling-727499cc
Wokesters in Search of Nonbinary Birds,2023-05-23,https://www.wsj.com/articles/wokesters-in-search-of-nonbinary-birds-1d65ed47
How Close Could the U.S. Get to a Default in June?,2023-05-22,https://www.wsj.com/articles/how-close-could-the-u-s-get-to-a-default-in-june-7fe145d7
Adidas Seeks Redemption in China,2023-05-21,https://www.wsj.com/articles/adidas-seeks-redemption-in-china-a872665a
Judge Rejects Partnership Between American Airlines and JetBlue,2023-05-20,https://www.wsj.com/articles/judge-rejects-partnership-between-american-airlines-and-jetblue-ac8e1792
Is the Right to Dissent Too Much to Ask at a University?,2023-05-19,https://www.wsj.com/articles/free-speech-silencing-censorship-college-campus-vanderbilt-c7131b95
Office Brainstorms Are a Waste of Time,2023-05-18,https://www.wsj.com/articles/cancel-that-brainstorm-theres-a-better-way-to-spur-good-ideas-f3c462d3
Penguin Random House Sues Florida School District Over Book Bans,2023-05-17,https://www.wsj.com/articles/penguin-random-house-sues-florida-school-district-over-book-bans-dd301e0f
"Influential Middle East Leader Woos Russia and China, Testing U.S. Ties",2023-05-16,https://www.wsj.com/articles/gulf-leader-tests-u-s-ties-with-moves-toward-russia-china-ecf9b779
Biden’s Bleak Story About Race in America Is False,2023-05-15,https://www.wsj.com/articles/bidens-bleak-story-about-race-in-america-is-false-howard-commencement-white-supremacy-779d4bb6
Migrants Wait Along Southern Border as New Rules Go Into Effect,2023-05-14,https://www.wsj.com/articles/migrants-wait-along-southern-border-as-new-rules-go-into-effect-e73df3a6
Biden to Nominate Philip Jefferson for Fed’s No. 2 Job,2023-05-13,https://www.wsj.com/articles/biden-to-nominate-philip-jefferson-for-feds-no-2-job-7ebfd5f4
Robert Rubin Warns That the U.S. Is Failing to Face Its Problems,2023-05-12,https://www.wsj.com/articles/robert-rubin-warns-that-the-u-s-is-failing-to-face-its-problems-16c7dcdb
OPEC’s Output Slipped in April Ahead of Saudi-Led Cuts,2023-05-11,https://www.wsj.com/articles/opecs-output-slipped-in-april-ahead-of-saudi-led-production-cuts-a0210b27
The False Abe Fortas Analogy,2023-05-10,https://www.wsj.com/articles/abe-fortas-was-actually-corrupt-legal-advice-sec-investigation-court-ethics-36cbcd55
Williams Says Fed Will Keep Watch on Lending Conditions,2023-05-09,https://www.wsj.com/articles/feds-john-williams-doesnt-say-whether-more-rate-rises-will-be-needed-4b33e5f2
Chinese Company Now Owns Tutoring Firm With Contracts in U.S.,2023-05-08,https://www.wsj.com/articles/princeton-review-and-tutor-com-are-now-owned-by-a-chinese-company-58ebea38
Tech Workers Aren’t as Rich as They Used to Be,2023-05-07,https://www.wsj.com/articles/tech-workers-arent-as-rich-as-they-used-to-be-d2292d64
Supreme Court Blocks Richard Glossip’s Execution,2023-05-06,https://www.wsj.com/articles/supreme-court-blocks-richard-glossips-execution-42b000a6
Wagner Threatens to Pull Out of Ukraine in Latest Internal Russia Spat,2023-05-05,https://www.wsj.com/articles/wagner-ukraine-russia-withdraw-6df13ff
"‘Velo’: In Cycling or Baseball, a Trendy Term for Speed",2023-05-04,https://www.wsj.com/articles/velo-in-cycling-or-baseball-a-trendy-term-for-speed-e4d78883
"TikTok Launches Ad Product for Publishers, Giving 50% Cut",2023-05-03,https://www.wsj.com/articles/tiktok-is-launching-an-ad-product-for-publishers-and-giving-them-a-50-cut-cff0c9a0
Bankrupt Bed Bath & Beyond Seeks Millions From Ocean Carriers,2023-05-02,https://www.wsj.com/articles/bankrupt-bed-bath-beyond-seeks-millions-from-ocean-carriers-4ec09c00
"Fed Restrictions on Employee Stock Trading Not Strict Enough, Says Watchdog ",2023-05-01,https://www.wsj.com/articles/fed-restrictions-on-employee-stock-trading-not-strict-enough-says-watchdog-8716d48b
China’s Consumers Lead Recovery in April,2023-04-30,https://www.wsj.com/articles/official-gauge-of-chinas-manufacturing-activity-fell-into-contraction-in-april-2f66258e
Transgender Influencer Dylan Mulvaney Speaks Out After Bud Light Controversy,2023-04-29,https://www.wsj.com/articles/transgender-influencer-dylan-mulvaney-speaks-out-after-bud-light-controversy-ec03af8
‘Sleeping Beauties’ Review: Nature’s Late Bloomers,2023-04-28,https://www.wsj.com/articles/sleeping-beauties-review-natures-late-bloomers-f1d41667
Why the Giannis Antetokounmpo ‘Failure’ Speech Is a Viral Phenomenon,2023-04-27,https://www.wsj.com/articles/giannis-antetokounmpo-failure-speech-bucks-nba-a37beed1
"In Manhattan, a Pair of Gilded-Age Townhouses Lists for $63 Million",2023-04-26,https://www.wsj.com/articles/in-manhattan-a-pair-of-gilded-age-townhouses-list-for-63-million-d45383a8
"In School, ‘Barry’ Star Anthony Carrigan Found It Easier to Hide in Plain Sight",2023-04-25,https://www.wsj.com/articles/anthony-carrigan-barry-f7ec24cc
Teenagers Learn by Paying Taxes,2023-04-24,https://www.wsj.com/articles/teenagers-learn-by-working-paying-taxes-6e14f34
Why the Banking Mess Isn’t Over,2023-04-23,https://www.wsj.com/articles/why-the-banking-mess-isnt-over-eb075a2f
Tennessee Republicans Fail to Move on Governor’s Gun-Control Proposal,2023-04-22,https://www.wsj.com/articles/tennessee-republicans-unlikely-to-move-on-governors-gun-control-proposal-eadfc488
Why Corporations Should Speak Up on Social Issues,2023-04-21,https://www.wsj.com/articles/corporate-social-justice-issues-gay-marriage-cf5d4082
Bestselling Books Week Ended April 15,2023-04-20,https://www.wsj.com/articles/bestselling-books-week-ended-april-15-e722725f
Biden Doesn’t Need Congress to Avoid a Debt-Ceiling Crisis,2023-04-19,https://www.wsj.com/articles/another-debt-ceiling-crisis-can-we-avoid-catastrophe-again-budget-legislative-fix-denmark-faith-credit-deficit-spending-constitution-e679cae9
Apple Opens First Retail Store in India as It Looks to Country for Manufacturing,2023-04-18,https://www.wsj.com/articles/apple-opens-its-first-retail-store-in-india-7f3a7035
Power Station Strike Knocks Out Electricity in Russian Border Area,2023-04-17,https://www.wsj.com/articles/power-station-strike-knocks-out-electricity-in-russian-border-region-4d016bdb
Santos’s Fundraising Stalls as Probes Loom,2023-04-16,https://www.wsj.com/articles/george-santos-house-campaign-fundraising-election-2024-4c7fde1e
"Cash App Founder Bob Lee’s Killing Followed Visit With Accused Killer’s Sister, Prosecutors Say",2023-04-15,https://www.wsj.com/articles/man-arrested-in-cash-app-founder-bob-lees-fatal-stabbing-set-to-appear-in-court-5d205776
Capitol Rioter Sentenced to More Than 7 Years,2023-04-14,https://www.wsj.com/articles/capitol-rioter-sentenced-to-more-than-7-years-for-assaulting-police-officer-565a2018
Imprisoned WSJ Reporter Evan Gershkovich Named to Time 100 List of Most Influential People,2023-04-13,https://www.wsj.com/articles/imprisoned-wsj-reporter-evan-gershkovich-named-to-time-100-list-of-most-influential-people-f7456c70
Bank of Canada Stands Pat on Rates,2023-04-12,https://www.wsj.com/articles/bank-of-canada-stands-pat-on-rates-on-expectation-of-inflation-growth-slowdown-62511090
Russia to Curb Draft-Dodging as It Denies Fresh Mobilization Plans,2023-04-11,https://www.wsj.com/articles/russia-to-curb-draft-dodging-as-it-denies-fresh-mobilization-plans-f18949da
Texas Abortion-Pill Ruling Ignites New National Battle,2023-04-10,https://www.wsj.com/articles/texas-abortion-pill-ruling-ignites-new-national-battle-a9c03329
Write a Message to Evan and His Family,2023-04-09,https://www.wsj.com/articles/show-your-support-for-evan-gershkovich-73b77140
Bank Regulator Drops Case Against Ex-Rabobank U.S. Compliance Chief,2023-04-08,https://www.wsj.com/articles/bank-regulator-drops-case-against-ex-rabobank-u-s-compliance-chief-549fa78f
U.S. Economy’s ‘Two Cycles’ Put Fed in a Pickle,2023-04-07,https://www.wsj.com/articles/u-s-economys-two-cycles-put-fed-in-a-pickle-751de824
Bank Failures. High Inflation. Rising Rates. Is the Resilient Jobs Market About to Crack?,2023-04-06,https://www.wsj.com/articles/bank-failures-high-inflation-rising-rates-is-the-resilient-jobs-market-about-to-crack-e1f566f6
"Texas Church-Shooting Victims, DOJ Reach Tentative Settlement",2023-04-05,https://www.wsj.com/articles/sutherland-springs-shooting-victims-u-s-reach-tentative-144-5-million-settlement-e2db4fc1
The Knicks’ Long Search for a Title Is Ongoing. The Search for a Point Guard Is Over.,2023-04-04,https://www.wsj.com/articles/the-knicks-long-search-for-a-championship-is-ongoing-the-search-for-a-point-guard-is-over-d194f30a
Israel’s Netanyahu Delays Defense Minister’s Dismissal,2023-04-03,https://www.wsj.com/articles/israels-netanyahu-delays-defense-ministers-dismissal-644b0cf0
SVB Collapse Complicates Banks’ Efforts to Unload Over $25 Billion of Junk Debt,2023-04-02,https://www.wsj.com/articles/svb-collapse-complicates-banks-efforts-to-unload-more-than-25-billion-of-junk-debt-a19ae78d
Trump Prepares to Surrender After Indictment,2023-04-01,https://www.wsj.com/articles/trump-lawyer-hits-airwaves-to-attack-new-york-indictment-9fb00702
California Legislators Consider Tolerance,2023-03-31,https://www.wsj.com/articles/california-legislators-consider-tolerance-35429c0c
Spring 2023 Reading: The 4 Best Books on Nature,2023-03-30,https://www.wsj.com/articles/spring-books-nature-d32596e4
"Satellite Operators SES, Intelsat Discuss Merger as Industry Looks to Consolidate",2023-03-29,https://www.wsj.com/articles/satellite-operators-ses-intelsat-discuss-merger-as-industry-looks-to-consolidate-f846b05c
French Protests Grow Volatile in Test for Macron,2023-03-28,https://www.wsj.com/articles/french-protests-grow-volatile-in-test-for-macron-3bec9003
There’s No Reason to Denigrate Trial Lawyers,2023-03-27,https://www.wsj.com/articles/theres-no-reason-to-denigrate-trial-lawyers-tort-personal-injury-insurance-721dbedd
Republicans Press Manhattan District Attorney for Trump Case Documents,2023-03-26,https://www.wsj.com/articles/republicans-press-manhattan-district-attorney-for-trump-case-documents-f144dd26
"Gordon Moore, Intel Co-Founder and Author of Moore’s Law, Dies at 94",2023-03-25,https://www.wsj.com/articles/gordon-moore-intel-co-founder-and-author-of-moores-law-dies-at-94-f3a6fcf6
Los Angeles School Strike Ends Without New Contracts,2023-03-24,https://www.wsj.com/articles/los-angeles-school-strike-ends-without-new-contracts-1fc76ed2
Gen. Trump D. Ripper Has a Doomsday Device for the GOP,2023-03-23,https://www.wsj.com/articles/donald-trump-2024-third-party-run-election-doomday-device-2c4236f2
Freight Rebound Hopes Are Fading Under an Inventory Glut,2023-03-22,https://www.wsj.com/articles/freight-rebound-hopes-are-fading-under-an-inventory-glut-912995d2
Iconic ‘Great Wave’ Print Sells for $2.8 Million at Christie’s,2023-03-21,https://www.wsj.com/articles/great-wave-print-auction-77a48cbf
Miami Beach Wants to Cancel Spring Break,2023-03-20,https://www.wsj.com/articles/miami-beach-wants-to-cancel-spring-break-sets-curfew-after-deadly-shootings-20426cd5
Online-Books Lawsuit Tests Limits of Libraries in Digital Age,2023-03-19,https://www.wsj.com/articles/online-books-lawsuit-tests-limits-of-libraries-in-digital-age-ae53bbe6
Biden Asks Congress for More Authority to Punish Bank Executives ,2023-03-18,https://www.wsj.com/articles/biden-asks-congress-for-more-authority-to-punish-bank-executives-828ea811
Hamptons Home Fetches $91.5 Million—More Than Double What It Sold for in 2020,2023-03-17,https://www.wsj.com/articles/hamptons-home-fetches-more-than-double-what-it-sold-for-in-2020-30aaaa68
"Europe Unveils Clean-Tech Plans in Bid to Rival U.S., China",2023-03-16,https://www.wsj.com/articles/europe-to-unveil-clean-tech-plans-in-bid-to-rival-u-s-china-a391ef5a
Marvel Takes Google and Reddit to Court Over Leaked ‘Ant-Man’ Script,2023-03-15,https://www.wsj.com/articles/marvel-takes-google-and-reddit-to-court-over-leaked-ant-man-script-914eadb
Social-Media Postings Amplify Anxiety Over SVB Collapse,2023-03-14,https://www.wsj.com/articles/social-media-postings-amplify-anxiety-over-svb-collapse-860d8f30
"Amazon, Rivian in Talks to End Delivery-Van Exclusivity",2023-03-13,https://www.wsj.com/articles/amazon-rivian-in-talks-to-end-exclusivity-part-of-delivery-van-pact-5cea809d
Urologists Market March Madness Vasectomies,2023-03-12,https://www.wsj.com/articles/march-madness-vasectomies-are-an-unlikely-pairing-filling-urology-offices-66ad7f84
"DeSantis Visits Iowa, With  Trump On the Way, as a 2024 Rivalry Builds",2023-03-11,https://www.wsj.com/articles/ron-desantis-heads-to-iowa-where-some-republicans-hunger-for-trump-alternative-77ee7622
"Vol. 36, No. 2: Firestorms",2023-03-10,https://www.wsj.com/articles/vol-36-no-2-firestorms-c12d621c
Disney’s Robert Iger Hints at Raising Streaming Prices ,2023-03-09,https://www.wsj.com/articles/disney-ceo-iger-need-to-figure-out-disney-pricing-strategy-aa470a0a
Lowe’s Opens Warehouses to Stow Goods to Improve Distribution,2023-03-08,https://www.wsj.com/articles/lowes-opens-warehouses-to-stow-goods-to-improve-seasonal-distribution-efficiency-13404404
‘Defund the Police’ Is Over. Now What?,2023-03-07,https://www.wsj.com/articles/defund-the-police-is-over-now-what-rising-crime-montgomery-county-eric-adams-breonna-taylor-recruiting-cadet-carjacking-indentity-theft-cd7bb1e
Seagen’s Cancer Therapy Is Making It a Takeover Target,2023-03-06,https://www.wsj.com/articles/why-big-drugmakers-want-to-buy-cancer-biotech-seagen-3adb9c4f
Wall Street Concedes There Is Finally an Alternative to Stocks,2023-03-05,https://www.wsj.com/articles/wall-street-concedes-there-is-finally-an-alternative-to-stocks-d19aebe6
Apple Approves ChatGPT-Powered App After Assurance of Content Moderation,2023-03-04,https://www.wsj.com/articles/apple-approves-chatgpt-powered-app-after-assurance-of-content-moderation-9c82cd7
Insider-Trading Cases Once Deemed Too Hard to Crack Are Now Targets of U.S. Government,2023-03-03,https://www.wsj.com/articles/insider-trading-cases-once-deemed-too-hard-to-crack-are-now-targets-of-u-s-government-c5320fac
Israel Faces a Question of Checks and Balances,2023-03-02,https://www.wsj.com/articles/israel-supreme-court-judicial-reform-checks-and-balances-395f7332
Vanessa Bryant Reaches Nearly $29 Million Settlement Over Kobe Bryant Crash Photos,2023-03-01,https://www.wsj.com/articles/vanessa-bryant-reaches-nearly-29-million-settlement-over-kobe-bryant-crash-photos-1ea9af76
FDA Restricts Imports of ‘Tranq’ Drug Xylazine,2023-02-28,https://www.wsj.com/articles/fda-restricts-imports-of-tranq-drug-xylazine-5711892c
"Nigeria Election Criticized by International Observers, Opposition Parties",2023-02-27,https://www.wsj.com/articles/nigerias-ruling-party-candidate-takes-early-lead-in-slow-vote-count-5875b068
Is Now a Good Time to Sell Your Home?,2023-02-26,https://www.wsj.com/articles/is-now-a-good-time-to-sell-your-home-ac27dc9b
Expedited Passport Renewals Taking Over a Month,2023-02-25,https://www.wsj.com/articles/expedited-passport-renewals-now-taking-over-a-month-68a2e886
AI-Generated Comic Book Keeps Copyright but Key Images Excluded,2023-02-24,https://www.wsj.com/articles/ai-generated-comic-book-zarya-of-the-dawn-keeps-copyright-but-key-images-excluded-c8094509
Crypto Company CoinEx Sued by New York Over Failure to Register,2023-02-23,https://www.wsj.com/articles/crypto-company-coinex-sued-by-new-york-over-failure-to-register-d25f667e
How Sweden Saved Social Security,2023-02-22,https://www.wsj.com/articles/how-sweden-saved-social-security-privatization-insolvency-market-brake-risk-contribution-biden-ef1583d3
Global Economy Shows Signs of Winter Resilience,2023-02-21,https://www.wsj.com/articles/europes-economy-picks-up-after-year-of-war-in-ukraine-26389fba
Five New Benefits and Perks Employers Will Tailor to Your Needs,2023-02-20,https://www.wsj.com/articles/five-new-benefits-and-perks-employers-will-tailor-to-your-needs-f6cebd1e
Earthquake Aid Flows Increase Into Northwest Syria,2023-02-19,https://www.wsj.com/articles/earthquake-aid-flows-increase-into-northwest-syria-69b5f86f
Microsoft Caps New Bing Usage After AI Chatbot Offered Unhinged Responses,2023-02-18,https://www.wsj.com/articles/microsoft-puts-caps-on-new-bing-usage-after-ai-chatbot-offered-unhinged-responses-39c3252f
DePauw University: Where DEI Goes Astray,2023-02-17,https://www.wsj.com/articles/depauw-university-where-dei-diversity-goes-astray-free-speech-eaaaffdd
Georgia Grand Jury Cites Possible Perjury in Trump Election Probe,2023-02-16,https://www.wsj.com/articles/georgia-judge-releases-parts-of-the-special-grand-jury-report-on-trump-2020-probe-e59695ad
Business Technology Chiefs Question ChatGPT’s Readiness for the Enterprise,2023-02-15,https://www.wsj.com/articles/business-technology-chiefs-question-chatgpts-readiness-for-the-enterprise-e6b38de0
DEI Is a Mask for Progressive Power,2023-02-14,https://www.wsj.com/articles/dei-diversity-equity-inclusion-left-wing-university-politics-e31ce039
"Philadelphia’s Jalen Hurts: In Defeat, an Appreciation",2023-02-13,https://www.wsj.com/articles/jalen-hurts-eagles-super-bowl-mahomes-5659589f
After Turkey’s Earthquake Comes the Reckoning. ‘Why Are We Unprepared?’ ,2023-02-12,https://www.wsj.com/articles/turkey-earthquake-erdogan-unprepared-edbe4d5d
"China’s Baidu Developing Its Own ChatGPT, Joining Global AI Race",2023-02-11,https://www.wsj.com/articles/baidu-is-developing-its-own-chatgpt-aiming-to-integrate-it-into-search-11675065601
Inside BP’s Decision to Dial Back Its Green Transition,2023-02-10,https://www.wsj.com/articles/inside-bps-decision-to-dial-back-its-green-transition-500d1f3c
"Biden Hits Republicans on Social Security, Medicare in Florida",2023-02-09,https://www.wsj.com/articles/biden-to-press-social-security-medicare-message-in-florida-11675964511
"What Biden’s Crackdown on ‘Junk Fees’ Could Mean for Travelers, Concertgoers and Credit Cards",2023-02-08,https://www.wsj.com/articles/what-bidens-crackdown-on-junk-fees-could-mean-for-travelers-concertgoers-and-credit-cards-11675884986
I Tried Microsoft’s New AI-Powered Bing. Search Will Never Be the Same.,2023-02-07,https://www.wsj.com/articles/i-tried-microsofts-new-ai-powered-bing-search-will-never-be-the-same-11675799762
Dershowitz’s Bad Idea to Plug the Dobbs Leak,2023-02-06,https://www.wsj.com/articles/dershowitz-bad-idea-plug-the-supreme-court-dobbs-leak-11675700269
"Amid Gas-Stove Debate, Some Makers Bet on Induction",2023-02-05,https://www.wsj.com/articles/induction-ranges-gain-favor-as-gas-stove-concerns-grow-11675565040
"Northeast Braces for Record Cold, Whiteout Conditions",2023-02-04,https://www.wsj.com/articles/northeast-braces-for-bitter-cold-as-wind-chill-could-hit-minus-65-degrees-in-some-areas-11675416328
More EVs to Qualify for Tax Credit,2023-02-03,https://www.wsj.com/articles/more-evs-to-qualify-for-tax-credit-following-treasury-changes-11675447739
"The Unusual Crew Behind Tether, Crypto’s Pre-Eminent Stablecoin",2023-02-02,https://www.wsj.com/articles/tether-ownership-and-company-weaknesses-revealed-in-documents-11675363340
The House Can Help Find the Supreme Court Leaker,2023-02-01,https://www.wsj.com/articles/the-house-can-help-find-the-supreme-court-leaker-dobbs-abortion-draft-opinion-source-investigation-reporter-11675270469
"How Do Full-Time RVers Get Mail, Pay Taxes? ‘You Can’t Just Fly by the Seat of Your Pants.’",2023-01-31,https://www.wsj.com/articles/living-in-an-rv-full-time-11675195516
"U.S. Presses Gulf States, EU to Boost Aid for Drought-Hit Somalia",2023-01-30,https://www.wsj.com/articles/u-s-presses-gulf-states-eu-to-boost-aid-for-drought-hit-somalia-11675095063
Some Western Backers of Ukraine Worry That Time Might Be on Russia’s Side,2023-01-29,https://www.wsj.com/articles/some-western-backers-of-ukraine-worry-that-time-might-be-on-russias-side-11674969063
Shooting at Jerusalem Synagogue Kills Seven People,2023-01-28,https://www.wsj.com/articles/jerusalem-attack-shooting-at-synagogue-kills-five-people-11674847488
‘Forbidden Notebook’ Review: A Journal of Her Own,2023-01-27,https://www.wsj.com/articles/forbidden-notebook-review-a-journal-of-her-own-11674843639
"11 Valentine’s Day Gifts That Delight all Five Senses, From the Softest Sweats to the Sweetest Strawberries",2023-01-26,https://www.wsj.com/articles/valentines-day-gifts-for-her-from-soft-sweats-to-sweet-strawberries-11674765974
"‘He Acts Swiftly.’ A 5-Year, Nearly $100 Million Buying Spree Unfolds on Nantucket and Martha’s Vineyard",2023-01-25,https://www.wsj.com/articles/investor-buys-homes-nantucket-marthas-vineyard-11674675814
ChatGPT at the Supreme Court?,2023-01-24,https://www.wsj.com/articles/chatgpt-ai-at-supreme-court-lawyer-11674539095
Xylem Shares Fall After It Agrees to $7.5 Billion Water Deal,2023-01-23,https://www.wsj.com/articles/xylem-shares-fall-after-agreeing-to-7-5-billion-water-deal-11674489248
Mexican Officials and Witnesses Recount Gunbattle That Captured Son of Joaquín ‘El Chapo’ Guzmán,2023-01-22,https://www.wsj.com/articles/mexican-officials-and-witnesses-recount-gunbattle-that-captured-son-of-joaquin-el-chapo-guzman-11674163002
Elon Musk Flags Limitations of Tweets in Tesla Trial,2023-01-21,https://www.wsj.com/articles/elon-musk-among-next-set-of-witnesses-in-tesla-tweets-trial-11674192908
14 Books We Read This Week,2023-01-20,https://www.wsj.com/articles/14-books-we-read-this-week-reviews-11674242590
"For CEOs at Davos, Efficiency and Profitability Reign Supreme",2023-01-19,https://www.wsj.com/articles/for-ceos-at-davos-efficient-profitable-operations-take-center-stage-11674151208
"Straight Out of ‘The Jetsons,’ This John Lautner-Designed L.A. Home Is Hitting the Market for $16 Million",2023-01-18,https://www.wsj.com/articles/this-16-million-john-lautner-designed-l-a-home-is-straight-out-of-the-the-jetsons-11674061590
Recent Trends in Insider Risk,2023-01-17,https://www.wsj.com/articles/recent-trends-in-insider-risk-11673983078
"Alibaba Seeks to Boost Sales Abroad With Buy Now, Pay Later",2023-01-16,https://www.wsj.com/articles/alibaba-seeks-to-boost-sales-abroad-with-buy-now-pay-later-11673867179
U.K. Is First Country to Agree to Send Western Battle Tanks to Ukraine,2023-01-15,https://www.wsj.com/articles/u-k-becomes-first-country-to-pledge-western-battle-tanks-to-ukraine-11673712045
Nova the Clouded Leopard Found at Dallas Zoo After Hourslong Search,2023-01-14,https://www.wsj.com/articles/dallas-zoo-closes-after-nova-the-clouded-leopard-goes-missing-11673640167
