title,date,url
Hospitals Warned on Price Disclosure Rule Compliance ,2021-05-08,https://www.wsj.com/articles/hospitals-draw-warning-on-price-disclosure-rule-compliance-11620442193
How Dogecoin Is Creating a Frenzy for the Next Big Cryptocurrency—and Why Experts Advise Caution,2021-05-07,https://www.wsj.com/articles/how-dogecoin-is-creating-a-frenzy-for-the-next-big-cryptocurrencyand-why-experts-advise-caution-11620411623
"With Wayfair, Look Past the Lockdown Boom ",2021-05-06,https://www.wsj.com/articles/with-wayfair-look-past-the-lockdown-boom-11620322643
Broadway Shows to Return Sept. 14 ,2021-05-05,https://www.wsj.com/articles/broadway-shows-to-return-sept-14-11620243638
How to Grow a Country Garden Without a Yard,2021-05-04,https://www.wsj.com/articles/how-to-grow-a-country-garden-without-a-yard-11620154426
How Much Money Do Millennials Make? It’s No Longer a Taboo Question,2021-05-03,https://www.wsj.com/articles/how-money-much-do-millennials-make-theyre-more-than-happy-to-tell-you-11620061103
Warren Buffett Defends Berkshire’s Moves Over Pandemic Year  ,2021-05-02,https://www.wsj.com/articles/warren-buffett-set-to-discuss-pandemic-markets-at-berkshires-annual-meeting-11619887342
D.C. Statehood Effort Stalls as Manchin Opposes Democrats’ Bill,2021-05-01,https://www.wsj.com/articles/d-c-statehood-faces-setback-as-manchin-opposes-democratic-push-11619827306
Israel Stampede Turned Hopes for Post-Pandemic Normalcy to Despair    ,2021-04-30,https://www.wsj.com/articles/israel-stampede-turned-hopes-for-post-pandemic-normalcy-to-despair-11619800685
Luxury Retailer Tapestry Names VF Executive as CFO,2021-04-29,https://www.wsj.com/articles/luxury-retailer-tapestry-names-vf-executive-as-cfo-11619722797
The Special Comfort of Audiobooks During Covid-19 and Trying Times,2021-04-28,https://www.wsj.com/articles/the-special-comfort-of-audiobooks-during-covid-19-and-trying-times-11619639796
The Class of 2020 Is Still Feeling the Impact of Lost Graduation,2021-04-27,https://www.wsj.com/articles/the-class-of-2020-is-still-feeling-the-impact-of-lost-graduation-11619549447
Google Bundles Products to Land Univision Cloud Deal,2021-04-26,https://www.wsj.com/articles/google-bundles-products-to-land-univision-cloud-deal-11619449740
Covid-19 Cases Linked to One Flight Highlight Risk of Pandemic Travel,2021-04-25,https://www.wsj.com/articles/covid-19-case-cluster-linked-to-one-flight-stirs-debate-among-health-experts-11619262004
"Do J&J and AstraZeneca Vaccines Cause Blood Clots, and What Are the Symptoms? ",2021-04-24,https://www.wsj.com/articles/j-j-astrazeneca-vaccines-blood-clots-11618329160
What to Read This Week,2021-04-23,https://www.wsj.com/articles/what-to-read-this-week-11619195499
India Hits Global Record for Daily New Covid-19 Cases,2021-04-22,https://www.wsj.com/articles/india-hits-global-record-for-daily-new-covid-19-cases-11619074547
Welcome to Joe Biden’s Boom Economy,2021-04-21,https://www.wsj.com/articles/welcome-to-joe-bidens-boom-economy-11619024019
"Chad’s President Dies After Battle With Rebels, Military Says",2021-04-20,https://www.wsj.com/articles/chads-president-dies-after-battle-with-rebels-military-says-11618921935
Navalny Hospitalized Three Weeks Into Hunger Strike,2021-04-19,https://www.wsj.com/articles/alexei-navalny-hospitalized-in-russia-three-weeks-into-hunger-strike-11618839052
"More Stocks Are Participating in Rally, Encouraging Sign for Bulls",2021-04-18,https://www.wsj.com/articles/more-stocks-are-participating-in-rally-an-encouraging-sign-for-bull-market-11618738201
Indianapolis FedEx Shooting: What We Know,2021-04-17,https://www.wsj.com/articles/indianapolis-shooting-fedex-11618580801
"Covid-19 Cases Rise in Maine Amid Variants, More Travel ",2021-04-16,https://www.wsj.com/articles/covid-19-cases-rise-in-maine-amid-variants-more-travel-11618594667
Not a Counterlife: A Run-in With Philip Roth in College,2021-04-15,https://www.wsj.com/articles/not-a-counterlife-a-run-in-with-philip-roth-in-college-11618513242
"Oil Demand Is Recovering Despite Vaccination Hiccups, IEA Says",2021-04-14,https://www.wsj.com/articles/oil-demand-is-recovering-despite-vaccination-hiccups-iea-says-11618387200
Grow or Mow? A Lawn War Springs Up in England,2021-04-13,https://www.wsj.com/articles/grow-or-mow-a-lawn-war-springs-up-in-england-11618336994
Ellen Says So Long to Her Beverly Hills Home,2021-04-12,https://www.wsj.com/articles/ellen-says-so-long-to-her-beverly-hills-home-11618245026
A City’s Only Hospital Cut Services. Locals Fought Back.,2021-04-11,https://www.wsj.com/articles/a-citys-only-hospital-cut-services-how-locals-fought-back-11618133400
XPO Logistics Taps CIO for Supply-Chain Services Spinoff,2021-04-10,https://www.wsj.com/articles/xpo-logistics-taps-cio-for-supply-chain-services-spinoff-11618013923
How Do You Count Wild Rhinos? Very Carefully. (And With Elephants),2021-04-09,https://www.wsj.com/articles/how-do-you-count-wild-rhinos-very-carefully-and-with-elephants-11617992334
A Way to Make Taxes Less Aggravating ,2021-04-08,https://www.wsj.com/articles/a-way-to-make-taxes-less-aggravating-11617911697
Golf Courses Target Those Who Think 18 Holes Is Just Too Many,2021-04-07,https://www.wsj.com/articles/golf-courses-target-those-who-think-18-holes-is-just-too-many-11617818400
Volkswagen Must Remove Bugs From Its Messaging,2021-04-06,https://www.wsj.com/articles/volkswagen-must-remove-bugs-from-its-messaging-11617730819
Middle Eastern Lentil Soup ,2021-04-05,https://www.wsj.com/articles/middle-eastern-lentil-soup-11614708089
"Pope Francis, in Easter Message, Calls for Better Distribution of Vaccines ",2021-04-04,https://www.wsj.com/articles/pope-francis-in-easter-message-calls-for-better-distribution-of-covid-19-vaccines-11617531494
"Suspect, Police Officer Dead After Attack Near U.S. Capitol",2021-04-03,https://www.wsj.com/articles/capitol-police-apprehend-suspect-after-crash-11617385751
Sex-Abuse Victims Duel With Boy Scouts for Right to Steer Bankruptcy,2021-04-02,https://www.wsj.com/articles/sex-abuse-victims-duel-with-boy-scouts-for-right-to-steer-bankruptcy-11617383922
"OPEC, Allies Agree to Boost Output, Betting on Demand Rebound",2021-04-01,https://www.wsj.com/articles/opec-agree-to-gradually-boost-oil-output-over-next-three-months-11617293942
Meatballs in a Chile-Tomato Broth,2021-03-31,https://www.wsj.com/articles/meatballs-in-a-chile-tomato-broth-11617212742
Coinbase Hires Ex-SEC Director to Run Capital Markets Division,2021-03-30,https://www.wsj.com/articles/coinbase-hires-ex-sec-director-to-run-capital-markets-division-11617123026
First Rule of Beltway Fight Club: Companies Can’t Defend Themselves,2021-03-29,https://www.wsj.com/articles/first-rule-of-beltway-fight-club-companies-cant-defend-themselves-11617034790
Mexican President Submits Bill to Boost State’s Role in Fuels,2021-03-28,https://www.wsj.com/articles/mexican-president-submits-bill-to-boost-states-role-in-fuels-market-11616883789
"Border Crossings by Children to Rise Sharply, U.S. Estimates Show",2021-03-27,https://www.wsj.com/articles/border-crossings-by-migrant-children-to-rise-sharply-according-to-internal-u-s-government-estimates-11616800942
Gertrude Vanderbilt Whitney’s Long Island Art Studio,2021-03-26,https://www.wsj.com/articles/gertrude-vanderbilt-whitneys-long-island-art-studio-11616780951
"Treasurys Calm, but Investors Anticipate a Rate Rise Soon",2021-03-25,https://www.wsj.com/articles/treasury-markets-calm-but-investors-anticipate-a-rate-rise-soon-11616681444
Texas Energy Regulators Can’t Dodge Blame,2021-03-24,https://www.wsj.com/articles/texas-energy-regulators-cant-dodge-blame-11616612596
Biggest Gains in Financial Strength in the Management Top 250,2021-03-23,https://www.wsj.com/articles/biggest-gains-in-financial-strength-in-the-management-top-250-11616522863
A Harvard Professor Brings 5G to M.B.A. Students,2021-03-22,https://www.wsj.com/articles/a-professor-brings-5g-to-m-b-a-students-11616434993
Demonstrators Call for End to Anti-Asian Violence in U.S. ,2021-03-21,https://www.wsj.com/articles/demonstrators-call-for-end-to-anti-asian-violence-in-u-s-11616279831
Derek Chauvin Judge Declines to Move Trial in Death of George Floyd ,2021-03-20,https://www.wsj.com/articles/derek-chauvin-judge-declines-to-move-trial-in-death-of-george-floyd-11616161961
"After Covid, Should You Keep Working From Home? Here’s How to Decide.",2021-03-19,https://www.wsj.com/articles/after-covid-should-you-keep-working-from-home-heres-how-to-decide-11616176802
Dan Bongino to Take Over Rush Limbaugh’s Airtime in Some Markets ,2021-03-18,https://www.wsj.com/articles/dan-bongino-to-take-over-rush-limbaughs-airtime-in-some-markets-11616092309
Adam Schiff Promoted by Powerful Allies for California Attorney General,2021-03-17,https://www.wsj.com/articles/adam-schiff-promoted-by-powerful-allies-for-california-attorney-general-11616009528
Five Things We Know About Google’s Ad Changes After Cookies,2021-03-16,https://www.wsj.com/articles/five-things-we-know-about-googles-ad-changes-after-cookies-11615919502
HighPoint Resources Files for Bankruptcy Ahead of Proposed Merger With Bonanza Creek ,2021-03-15,https://www.wsj.com/articles/highpoint-resources-files-for-bankruptcy-ahead-of-proposed-merger-with-bonanza-creek-11615827585
"Marvin Hagler, Middleweight Boxing Great, Dies at 66",2021-03-14,https://www.wsj.com/articles/marvin-hagler-middleweight-boxing-great-dies-at-66-11615683526
George Floyd Family Reaches $27 Million Settlement With Minneapolis,2021-03-13,https://www.wsj.com/articles/george-floyd-family-reaches-27-million-settlement-with-city-of-minneapolis-11615575561
How to Negotiate Salary for a New Job: The Do’s and Don’ts,2021-03-12,https://www.wsj.com/articles/how-to-negotiate-a-job-offer-the-dos-and-donts-11607553703
"Equality Goes With Freedom, Equity Doesn’t",2021-03-11,https://www.wsj.com/articles/equality-goes-with-freedom-equity-doesnt-11615490177
Metals Tycoon Gupta Hires Advisers to Navigate Greensill Fallout ,2021-03-10,https://www.wsj.com/articles/metals-tycoon-gupta-hires-advisers-to-navigate-greensill-fallout-11615394876
An Improvement on the 12th Amendment for Elections,2021-03-09,https://www.wsj.com/articles/an-improvement-on-the-12th-amendment-for-elections-11615316790
Remote Work Could Revolutionize Jobs for Autistic People,2021-03-08,https://www.wsj.com/articles/as-remote-work-becomes-the-norm-vast-new-possibilities-open-for-people-with-autism-11615222804
Brokers and Investors Face a Crazy Quilt of State Regulations,2021-03-07,https://www.wsj.com/articles/financial-advisers-and-investors-face-a-crazy-quilt-of-state-regulations-11615122000
"California to Allow Theme Parks, Stadiums to Open With Conditions",2021-03-06,https://www.wsj.com/articles/california-allows-for-theme-parks-stadiums-and-ballparks-to-open-outdoors-under-certain-conditions-11614987302
How to Cook Smarter: Easy Recipes and Pandemic Takeaways,2021-03-05,https://www.wsj.com/articles/cooking-smarter-pandemic-takeaways-practical-recipes-11614965515
Leading a Digital Overhaul? Here’s Some Advice ,2021-03-04,https://www.wsj.com/articles/leading-a-digital-overhaul-heres-some-advice-11614889050
Deaths Mount as Myanmar’s Military Seeks to Crush Protests,2021-03-03,https://www.wsj.com/articles/nine-killed-in-myanmar-as-regime-seeks-to-crush-anticoup-protests-11614775439
Nigerian Gunmen Release Hundreds of Kidnapped Girls,2021-03-02,https://www.wsj.com/articles/nigerian-gunmen-release-hundreds-of-kidnapped-schoolgirls-11614666984
Former French President Sarkozy Convicted in Corruption Trial,2021-03-01,https://www.wsj.com/articles/former-french-president-sarkozy-convicted-in-corruption-trial-11614605343
"China Got Its Economy Growing Again, but a Shortfall in Babies Will Be Harder to Fix",2021-02-28,https://www.wsj.com/articles/china-got-its-economy-growing-again-but-a-shortfall-in-babies-will-be-harder-to-fix-11614488414
No Republican Civil War Over Trump at CPAC,2021-02-27,https://www.wsj.com/articles/republican-civil-war-over-trump-not-at-cpac-11614366303
"India Returns to Growth, but Recovery Divides Rich and Poor ",2021-02-26,https://www.wsj.com/articles/india-returns-to-growth-but-recovery-divides-rich-and-poor-11614344173
Israel Has Many Baha’is but India Has Even More,2021-02-25,https://www.wsj.com/articles/israel-has-many-bahais-but-india-has-even-more-11614286112
Wine Can Be Fun—Seriously,2021-02-24,https://www.wsj.com/articles/wine-can-be-funseriously-11614196278
Black News Channel Looks to Shake Up Cable-TV News Landscape ,2021-02-23,https://www.wsj.com/articles/black-news-channel-looks-to-shake-up-cable-tv-news-landscape-11614099600
Italian Ambassador Killed in Rebel Ambush in Eastern Congo,2021-02-22,https://www.wsj.com/articles/italian-ambassador-killed-in-rebel-ambush-in-eastern-congo-11614008055
United Flight Lands in Denver Following Engine Failure,2021-02-21,https://www.wsj.com/articles/united-flight-lands-in-denver-following-engine-failure-shortly-after-takeoff-11613863171
Reddit Legend Keith Gill Boosts Stake in GameStop ,2021-02-20,https://www.wsj.com/articles/reddit-legend-keith-gill-boosts-stake-in-gamestop-11613779373
How Serious Are Biden and the Democrats About Fighting Climate Change?,2021-02-19,https://www.wsj.com/articles/how-serious-are-biden-and-the-democrats-about-fighting-climate-change-11613756593
Winter Storms Delay Vaccine Deliveries to New York City ,2021-02-18,https://www.wsj.com/articles/new-york-city-braces-for-major-storm-11613658846
What a $15 Minimum Wage Will Really Do,2021-02-17,https://www.wsj.com/articles/what-a-15-minimum-wage-will-really-do-11613589213
Myanmar’s Aung San Suu Kyi Attends Closed Court Hearing ,2021-02-16,https://www.wsj.com/articles/aung-san-suu-kyi-detained-since-myanmars-coup-attends-closed-court-hearing-11613482752
The Currency Market Snoozefest Might Not Last,2021-02-15,https://www.wsj.com/articles/the-currency-market-snoozefest-may-not-last-11613382029
White House Spokesman Resigns After Threatening Remarks to Reporter,2021-02-14,https://www.wsj.com/articles/white-house-spokesman-resigns-after-threatening-remarks-to-politico-reporter-11613266639
Biden’s SEC Chief Nominee Reports Net Worth of Up to $119 Million ,2021-02-13,https://www.wsj.com/articles/bidens-nominee-for-sec-chief-gary-gensler-reports-net-worth-between-41-million-and-119-million-11613147087
"Tariffs on Wine, Food From Europe to Stay for Now, U.S. Says ",2021-02-12,https://www.wsj.com/articles/tariffs-on-wine-food-from-europe-to-stay-for-now-u-s-says-11613154058
Surging U.S. Home Prices Gain Momentum as Rally Intensifies,2021-02-11,https://www.wsj.com/articles/surging-u-s-home-prices-gaining-momentum-as-rally-intensifies-11613062810
Remembering the Late and Great George Pratt Shultz,2021-02-10,https://www.wsj.com/articles/remembering-the-late-and-great-george-pratt-shultz-11612983174
The NYSE Isn’t Moving—Yet,2021-02-09,https://www.wsj.com/articles/the-nyse-isnt-movingyet-11612893427
Green Hydrogen Plant in Saudi Desert Aims to Reshape Energy Grid,2021-02-08,https://www.wsj.com/articles/green-hydrogen-plant-in-saudi-desert-aims-to-amp-up-clean-power-11612807226
Jeep Super Bowl Ad Enlists Bruce Springsteen to Unite America ,2021-02-07,https://www.wsj.com/articles/jeep-super-bowl-ad-enlists-bruce-springsteen-to-unite-america-11612674060
Ex-TPG Executive to Plead Guilty in Admissions Scandal ,2021-02-06,https://www.wsj.com/articles/former-tpg-executive-to-plead-guilty-in-college-admissions-case-11612565299
Libya Forms Transitional Unity Government After Years Of Conflict,2021-02-05,https://www.wsj.com/articles/libya-forms-transitional-unity-government-after-years-of-conflict-11612542685
Which Cooking Oil Should I Use?,2021-02-04,https://www.wsj.com/articles/whats-the-best-cooking-oil-11612472812
The Short March Back to Inflation,2021-02-03,https://www.wsj.com/articles/the-short-march-back-to-inflation-11612378471
Kraft Heinz Nears Deal to Sell Planters Brand to Hormel,2021-02-02,https://www.wsj.com/articles/hormel-in-talks-to-buy-planters-from-kraft-heinz-for-around-3-billion-11612291856
Weary Essential Workers Soldier On Through the Pandemic,2021-02-01,https://www.wsj.com/articles/pandemic-wears-on-essential-workers-everybody-forgets-that-youre-still-on-the-front-line-11612197832
Real-Estate Startup Knotel Files for Chapter 11 Bankruptcy,2021-01-31,https://www.wsj.com/articles/real-estate-startup-knotel-files-for-chapter-11-bankruptcy-11612146627
"Apple, General Motors, Novavax: Stocks That Defined the Week",2021-01-30,https://www.wsj.com/articles/apple-general-motors-novavax-stocks-that-defined-the-week-11611965477
Fuss Over Central Park Snowy Owl Suggests New Yorkers Give a Hoot,2021-01-29,https://www.wsj.com/articles/fuss-over-central-park-snowy-owl-suggests-new-yorkers-give-a-hoot-11611944986
Chicago Teachers Strike Could Upend Reopening Plans,2021-01-28,https://www.wsj.com/articles/chicago-teachers-strike-could-upend-reopening-plans-11611829801
"WHO Recommends Against Moderna, Pfizer Vaccines for Most Pregnant Women",2021-01-27,https://www.wsj.com/articles/who-recommends-against-moderna-pfizer-vaccines-for-most-pregnant-women-11611775138
‘Soldier Songs’ and ‘Titon et L’Aurore’ Reviews: War’s Wounds and Love’s Arrow,2021-01-26,https://www.wsj.com/articles/soldier-songs-and-titon-et-laurore-reviews-wars-wounds-and-loves-arrow-11611689387
"Davos This Year: Silent Streets, Good Skiing",2021-01-25,https://www.wsj.com/articles/davos-this-year-silent-streets-good-skiing-11611596053
"Arizona GOP Censures Cindy McCain, Doug Ducey, Re-Elects Kelli Ward as Chair",2021-01-24,https://www.wsj.com/articles/arizona-gop-censures-cindy-mccain-doug-ducey-re-elects-kelli-ward-as-chair-11611453988
Samsung Eyes Investing Up to $17 Billion in New U.S. Chip Plant ,2021-01-23,https://www.wsj.com/articles/samsung-eyes-up-to-17-billion-u-s-chip-plant-investment-11611361050
Has the Left Hijacked King’s Loving Vision?,2021-01-22,https://www.wsj.com/articles/has-the-left-hijacked-kings-loving-vision-11611338906
Our Sense of Fairness Is Beyond Politics,2021-01-21,https://www.wsj.com/articles/our-sense-of-fairness-is-beyond-politics-11611255445
"Morgan Stanley Profit Shoots Higher, Fueled by Wall Street ",2021-01-20,https://www.wsj.com/articles/morgan-stanley-quarterly-profit-climbs-51-11611147469
College Board Eliminates SAT Subject Tests ,2021-01-19,https://www.wsj.com/articles/college-board-eliminates-sat-subject-tests-11611072391
Biotech’s Price Tag Is Crazy but Not Insane ,2021-01-18,https://www.wsj.com/articles/biotechs-price-tag-is-crazy-but-not-insane-11610974801
Some GOP Freshmen Stir Early Controversy,2021-01-17,https://www.wsj.com/articles/some-gop-freshmen-mock-masks-embrace-gun-rights-spar-with-colleagues-11610805601
FAA Approves Fully Automated Commercial Drone Flights ,2021-01-16,https://www.wsj.com/articles/faa-approves-first-fully-automated-commercial-drone-flights-11610749377
Former Petrofac Executive Pleads Guilty to Three Counts of Bribery,2021-01-15,https://www.wsj.com/articles/former-petrofac-executive-pleads-guilty-to-three-counts-of-bribery-11610737627
Columbia’s China Program Avoids Chinese Problems,2021-01-14,https://www.wsj.com/articles/columbias-china-program-avoids-chinese-problems-11610653453
Shrinking Grain Supplies Send Prices Soaring ,2021-01-13,https://www.wsj.com/articles/shrinking-grain-supplies-send-prices-soaring-11610552009
"New York City Covid-19 Vaccine Program Has Shaky Start, Council Members Say ",2021-01-12,https://www.wsj.com/articles/new-york-city-covid-19-vaccine-program-has-shaky-start-councilmembers-say-11610481562
New York State Bar Association Weighs Stripping Giuliani of Membership,2021-01-11,https://www.wsj.com/articles/new-york-state-bar-association-weighs-stripping-giuliani-of-membership-11610382286
Support Grows for Trump Impeachment Over Capitol Riot ,2021-01-10,https://www.wsj.com/articles/support-grows-for-trump-impeachment-over-capitol-riot-11610235019
Hawley Faces Fierce Backlash After Capitol Riot ,2021-01-09,https://www.wsj.com/articles/hawley-faces-fierce-backlash-from-colleagues-donors-after-capitol-riot-11610150574
The Online Discount Algorithms Need to Chill Out ,2021-01-08,https://www.wsj.com/articles/the-online-discount-algorithms-need-to-chill-out-11610128609
Federal Investigators Probing AmEx Card Sales Practices ,2021-01-07,https://www.wsj.com/articles/federal-investigators-probing-amex-card-sales-practices-11610039815
GM Passes Ford in Closely Watched Truck Race ,2021-01-06,https://www.wsj.com/articles/gm-passes-ford-in-closely-watched-truck-race-11609954701
Avoiding a Confrontation Has Facilitated China’s Rise,2021-01-05,https://www.wsj.com/articles/avoiding-a-confrontation-has-facilitated-chinas-rise-11609871668
Millennial Buyers Help Global Art Market Survive the Covid Pandemic,2021-01-04,https://www.wsj.com/articles/millennial-buyers-help-global-art-market-survive-the-covid-pandemic-11609779511
"From Stocks to Bitcoin, Investors Bet the ‘Everything Rally’ Will Continue",2021-01-03,https://www.wsj.com/articles/from-stocks-to-bitcoin-investors-bet-the-everything-rally-will-continue-11609669800
Drugmakers Raise Prices in the New Year,2021-01-02,https://www.wsj.com/articles/drugmakers-raise-prices-3-3-in-the-new-year-11609521644
Hong Kong’s Political Prisoners,2021-01-01,https://www.wsj.com/articles/hong-kongs-political-prisoners-11609460193
Children’s Books: Free Range,2020-12-31,https://www.wsj.com/articles/childrens-books-free-range-11609429586
Cold War With China Is Avoidable,2020-12-30,https://www.wsj.com/articles/cold-war-with-china-is-avoidable-11609347643
"Columbus, Ohio, Police Officer Fired After Killing Black Man",2020-12-29,https://www.wsj.com/articles/columbus-ohio-police-officer-fired-after-fatal-shooting-of-unarmed-black-man-11609267807
"Republican Electors Cast Unofficial Ballots, Setting Up Congressional Clash",2020-12-28,https://www.wsj.com/articles/republican-electors-cast-unofficial-ballots-setting-up-congressional-clash-11609164000
"Hate-Crime Bills Gain Support in South Carolina, Arkansas ",2020-12-27,https://www.wsj.com/articles/hate-crime-bills-gain-support-in-south-carolina-arkansas-11609065000
Svalbard Sling,2020-12-26,https://www.wsj.com/articles/svalbard-sling-11608958801
How to Help Others During This Holiday Season,2020-12-25,https://www.wsj.com/articles/inspiring-holiday-messages-during-the-pandemic-11608047050
Covid Threw People’s Finances Into Disarray,2020-12-24,https://www.wsj.com/articles/covid-threw-peoples-finances-into-disarray-it-doesnt-look-pretty-11608821977
How British Scientists Tracked Down the New Covid-19 Variant ,2020-12-23,https://www.wsj.com/articles/how-british-scientists-tracked-down-the-new-covid-19-variant-11608750228
Wave of Attempted Fraud Hits Unemployment Claims Programs ,2020-12-22,https://www.wsj.com/articles/wave-of-attempted-fraud-hits-state-unemployment-claims-programs-11608633000
How the Woke Stole Christmas,2020-12-21,https://www.wsj.com/articles/how-the-woke-stole-christmas-11608569820
Tesla Bulls Double Down as Stock Reaches New Heights,2020-12-20,https://www.wsj.com/articles/tesla-bulls-double-down-as-stock-reaches-new-heights-11608460200
"After Covid Took His Father, a Hospital Boss Leans on His Wisdom",2020-12-19,https://www.wsj.com/articles/after-covid-took-his-father-a-hospital-boss-leans-on-his-wisdom-11608354019
Scenes From Pompeii—or Maybe My Abandoned Manhattan Office,2020-12-18,https://www.wsj.com/articles/scenes-from-pompeiior-maybe-my-abandoned-manhattan-office-11608318789
Macron Tests Positive for Covid-19,2020-12-17,https://www.wsj.com/articles/frances-macron-tests-positive-for-covid-19-11608198351
The Lockerbie Bombing’s Long Trail of Pain and Investigation    ,2020-12-16,https://www.wsj.com/articles/the-lockerbie-bombings-long-trail-of-pain-and-investigation-11608151752
Georgia to Review Mail-In Ballot Signatures to Boost Confidence in Elections ,2020-12-15,https://www.wsj.com/articles/georgia-to-review-mail-in-ballot-signatures-to-boost-confidence-in-elections-11608058670
Adidas Explores Sale of Reebok,2020-12-14,https://www.wsj.com/articles/adidas-explores-sale-of-reebok-11607969262
Covid-19 Poses Christmas Quandary for Families    ,2020-12-13,https://www.wsj.com/articles/covid-19-poses-christmas-quandary-for-families-11607875200
Intel Not Inside: How Mobile Chips Overtook the Semiconductor Giant,2020-12-12,https://www.wsj.com/articles/intel-not-inside-how-mobile-chips-overtook-the-semiconductor-giant-11607749203
"Rows Garden (Saturday Variety Puzzle, December 12)",2020-12-11,https://www.wsj.com/articles/rows-garden-saturday-variety-puzzle-december-12-11607295320
"The GOP Abandoned Fiscal Discipline Long, Long Ago",2020-12-10,https://www.wsj.com/articles/the-gop-abandoned-fiscal-discipline-long-long-ago-11607633154
‘Lockdown Lite’ Spares Economies but Doesn’t End Pandemic,2020-12-09,https://www.wsj.com/articles/lockdown-lite-spares-economies-but-doesnt-end-pandemic-11607531785
New Jersey Starts $190 Million Makeover of Newark Penn Station,2020-12-08,https://www.wsj.com/articles/new-jersey-starts-190-million-makeover-of-newark-penn-station-11607458412
"On Student Debt, Biden Must Decide Whose Loans to Cancel",2020-12-07,https://www.wsj.com/articles/on-student-debt-biden-must-decide-who-would-benefit-11607356246
Federal Judge Orders Government to Fully Restore DACA ,2020-12-06,https://www.wsj.com/articles/federal-judge-orders-government-to-fully-restore-daca-11607133464
Chance the Rapper Sued by Former Manager ,2020-12-05,https://www.wsj.com/articles/chance-the-rapper-sued-by-former-manager-11607127219
How to Build a Home on the Moon,2020-12-04,https://www.wsj.com/articles/how-to-build-a-home-on-the-moon-11607106600
"Frank Carney, Pizza Hut Co-Founder, Dies at Age 82 ",2020-12-03,https://www.wsj.com/articles/frank-carney-pizza-hut-co-founder-dies-at-age-82-11607012338
