title,date,url
"Accused Salman Rushdie Attacker Charged With Attempted Murder, Assault",2022-08-14,https://www.wsj.com/articles/accused-salman-rushdie-attacker-charged-with-attempted-murder-assault-11660411604
Fernando Tatís Jr. Suspended 80 Games by MLB for Positive Drug Test,2022-08-13,https://www.wsj.com/articles/fernando-tatis-jr-mlb-suspension-11660352929
Consumer Sentiment Improved in August,2022-08-12,https://www.wsj.com/articles/u-s-consumer-sentiment-improved-in-august-from-early-summer-low-11660323092
Xi’s Message to Biden on Taiwan: Now Is No Time for a Crisis ,2022-08-11,https://www.wsj.com/articles/xi-sought-to-send-message-to-biden-on-taiwan-now-is-no-time-for-a-crisis-11660240698
"Why Buy Classic Furniture Designs New When They Resell at 50%?
		
			",2022-08-10,https://www.wsj.com/articles/when-classic-designs-resell-at-50-why-buy-them-new-11660151879
Rapid Wage Growth Keeps Pressure on U.S. Inflation,2022-08-09,https://www.wsj.com/articles/rapid-wage-growth-keeps-pressure-on-u-s-inflation-11660037402
The Union and the Murderer,2022-08-08,https://www.wsj.com/articles/labor-union-teacher-tenure-hearing-11659935107
"Colleges, Parents Fight Over Tuition During Covid Closures ",2022-08-07,https://www.wsj.com/articles/colleges-parents-fight-in-court-over-tuition-charged-during-pandemic-closures-11659865504
First Convoy of Ships Carrying Ukrainian Grain Leaves Odessa Under New Deal,2022-08-06,https://www.wsj.com/articles/first-convoy-of-ships-carrying-ukrainian-grain-leave-odessa-under-new-deal-11659697193
"Hudson Valley Weekend Trips: Where to Find the Region’s Best New Restaurants, Hotels and Kombucha Sorbet",2022-08-05,https://www.wsj.com/articles/hudson-valley-weekend-trips-where-to-find-the-regions-best-new-restaurants-hotels-and-kombucha-sorbet-11659720600
The Amazing Permutations of Bell-Ringing ,2022-08-04,https://www.wsj.com/articles/the-amazing-permutations-of-bell-ringing-11659640715
"Senate Plan Would Put Bitcoin, Ether Under Commodity Regulator’s Watch ",2022-08-03,https://www.wsj.com/articles/senate-plan-would-put-bitcoin-ether-under-commodity-regulators-watch-11659499261
Rivian Says Senate Climate Deal Puts It at Disadvantage ,2022-08-02,https://www.wsj.com/articles/rivian-says-senate-climate-deal-puts-it-at-disadvantage-11659460641
Renters Finally See Market Starting to Cool After Record Growth,2022-08-01,https://www.wsj.com/articles/apartment-rents-begin-tapering-off-after-record-growth-11659301974
"China Home Sales Plunge in July, as Mortgage Revolt Deters Buyers",2022-07-31,https://www.wsj.com/articles/china-home-sales-plunge-in-july-as-mortgage-revolt-deters-buyers-11659264152
Procter & Gamble Sounds a Warning After Strong Quarter,2022-07-30,https://www.wsj.com/articles/procter-gamble-sounds-a-warning-after-strong-quarter-11659092616
Radical Reform vs. the People,2022-07-29,https://www.wsj.com/articles/progressive-reform-green-energy-transition-crime-prison-incarceration-11659030825
"Recession or Not, the Recovery Has Ended",2022-07-28,https://www.wsj.com/articles/recession-or-not-the-recovery-has-ended-11659031090
Energy Prices in Europe Surge After Russia Slashes Gas Flows,2022-07-27,https://www.wsj.com/articles/energy-prices-in-europe-surge-after-russia-slashes-gas-flows-11658922623
The Catholic Church Has a Duty to Correct the Powerful on Abortion,2022-07-26,https://www.wsj.com/articles/catholic-church-abortion-communion-eucharist-politician-pelosi-biden-james-martin-graebe-11658789464
Uvalde Is Not the Face of Policing in America,2022-07-25,https://www.wsj.com/articles/uvalde-police-mass-school-shooting-peggy-noonan-11658761772
Weak Earnings Reports Aren’t Fazing Investors,2022-07-24,https://www.wsj.com/articles/weak-earnings-reports-arent-fazing-investors-after-brutal-year-for-stocks-11658615669
Vince McMahon Out as WWE CEO Amid Sexual Harassment Scandal,2022-07-23,https://www.wsj.com/articles/wwes-vince-mcmahon-retires-as-ceo-chairman-11658521448
"U.S., Global Business Activity Slid in July",2022-07-22,https://www.wsj.com/articles/eurozone-economy-seen-contracting-as-ecb-raises-borrowing-costs-11658485175
Americans Said No to Bernie Sanders,2022-07-21,https://www.wsj.com/articles/bernie-sanders-president-socialist-policy-democrats-primary-11658328907
Justin Bieber Is Going Back on Tour After Disclosure of Ramsay Hunt Syndrome,2022-07-20,https://www.wsj.com/articles/justin-bieber-is-going-back-on-tour-after-disclosure-of-ramsay-hunt-syndrome-11658342417
U.S. Disrupts North Korean Ransomware Attacks,2022-07-19,https://www.wsj.com/articles/u-s-disrupts-north-korean-ransomware-campaign-against-hospitals-11658245206
"No Deals, No Problem on Wall Street ",2022-07-18,https://www.wsj.com/articles/no-deals-no-problem-on-wall-street-11658160062
American Fred Kerley Is the World’s Fastest Man,2022-07-17,https://www.wsj.com/articles/fred-kerley-worlds-fastest-man-11658028436
Virgin Galactic Strikes Deals to Expand Fleet,2022-07-16,https://www.wsj.com/articles/virgin-galactic-strikes-deals-to-expand-fleet-11657886400
Power Dressing in Spanish Colonial America,2022-07-15,https://www.wsj.com/articles/power-dressing-in-spanish-colonial-america-11657908090
Fed Official Says 0.75-Point Rate Rise Seems Most Likely in July,2022-07-14,https://www.wsj.com/articles/fed-official-says-0-75-point-rate-rise-seems-most-likely-in-july-11657810869
"A Pink Cadillac for Cruising Down the Street, Fuzzy Dice and All",2022-07-13,https://www.wsj.com/articles/a-pink-cadillac-for-cruising-down-the-street-fuzzy-dice-and-all-11655493699
Google Countersues Match for Breach of Contract Over App Store Payments,2022-07-12,https://www.wsj.com/articles/google-countersues-match-for-breach-of-contract-over-app-store-payments-11657649459
Britain’s Conservatives Rise Above Identity Politics,2022-07-11,https://www.wsj.com/articles/britain-conservatives-rise-above-identity-politics-rishi-sunak-penny-mordaunt-prime-minister-11657552012
"Luis Echeverría, Former President of Mexico, Dies at 100 ",2022-07-10,https://www.wsj.com/articles/luis-echeverria-former-president-of-mexico-dies-at-100-11657411277
Suncor Says CEO to Exit Immediately ,2022-07-09,https://www.wsj.com/articles/suncor-says-ceo-to-exit-immediately-11657327261
Appeals Court Tosses Roy Moore’s Defamation Lawsuit Against Sacha Baron Cohen,2022-07-08,https://www.wsj.com/articles/appeals-court-tosses-roy-moores-95-million-defamation-lawsuit-against-sacha-baron-cohen-11657302238
Macron Seeks to Step Up France’s Inflation Fight,2022-07-07,https://www.wsj.com/articles/macron-tries-to-step-up-frances-inflation-fight-11657216307
France’s Macron Confronts Divided Parliament With Plan to Raise Retirement Age,2022-07-06,https://www.wsj.com/articles/frances-macron-confronts-divided-parliament-with-plan-to-raise-retirement-age-11657130429
The Justice of Race-Based Housing Assistance,2022-07-05,https://www.wsj.com/articles/fannie-mae-housing-assistance-race-reparation-law-11657033925
Coal Makes a Comeback as the World Thirsts for Energy,2022-07-04,https://www.wsj.com/articles/coal-makes-a-comeback-as-the-world-thirsts-for-energy-11656936180
Worried About Personal-Data Leaks? Here’s How to Lock Down Your Phone,2022-07-03,https://www.wsj.com/articles/worried-about-personal-data-leaks-heres-how-to-lock-down-your-phone-11656799748
Jerry Hall Files for Divorce From Rupert Murdoch,2022-07-02,https://www.wsj.com/articles/jerry-hall-files-for-divorce-from-rupert-murdoch-11656720768
Panera Bread Ends IPO Deal With Danny Meyer’s SPAC,2022-07-01,https://www.wsj.com/articles/panera-bread-scraps-ipo-deal-with-danny-meyers-spac-11656697556
"Sonny Barger, Hells Angels Leader, Dies of Cancer at 83",2022-06-30,https://www.wsj.com/articles/sonny-barger-hells-angels-leader-dies-of-cancer-at-83-11656611545
Elizabeth Warren Wants the Fed to Write a Fairy Tale,2022-06-29,https://www.wsj.com/articles/elizabeth-warren-federal-reserve-jerome-powell-soft-landing-inflation-rate-hikes-11656427417
101-Year-Old Former Nazi Guard Sentenced to 5 Years in Prison for Role at Concentration Camp,2022-06-28,https://www.wsj.com/articles/101-year-old-former-nazi-guard-sentenced-to-5-years-in-prison-for-role-at-concentration-camp-11656441194
How the Supreme Court Overturned Roe v. Wade and Abortion Rights,2022-06-27,https://www.wsj.com/articles/what-does-overturning-roe-v-wade-mean-explained-11656081705
G-7 to Expand Sanctions on Moscow With Ban on Russian Gold ,2022-06-26,https://www.wsj.com/articles/g-7-to-expand-sanctions-on-moscow-with-ban-on-russian-gold-11656188725
Supreme Court’s Abortion Decision Sparks Immediate Action From States ,2022-06-25,https://www.wsj.com/articles/supreme-courts-abortion-decision-sparks-immediate-action-from-states-11656096002
Can Inflatable Outdoor Furniture Ever Be Chic?,2022-06-24,https://www.wsj.com/articles/can-inflatable-outdoor-furniture-ever-be-chic-11656097202
Greitens’s Senate Bid Sparks GOP Worry,2022-06-23,https://www.wsj.com/articles/missouri-republican-eric-greitenss-senate-bid-sparks-gop-opposition-worry-11656005964
The PGA Tour’s Counterattack to LIV Golf: More Lucrative Tournaments,2022-06-22,https://www.wsj.com/articles/liv-golf-pga-tour-jay-monahan-brooks-koepka-11655925572
"In Today’s Market, Poor Performance Still Pays",2022-06-21,https://www.wsj.com/articles/in-todays-market-poor-performance-still-pays-11655726401
Labor Shortage Stymies Construction Work as $1 Trillion Infrastructure Spending Kicks In ,2022-06-20,https://www.wsj.com/articles/labor-shortage-stymies-construction-work-as-1-trillion-infrastructure-spending-kicks-in-11655722801
Apple Employees at Maryland Store Vote to Unionize,2022-06-19,https://www.wsj.com/articles/apple-employees-at-retail-store-vote-to-unionize-11655599634
WWE’s McMahon Steps Down Temporarily Amid Probe,2022-06-18,https://www.wsj.com/articles/wwe-appoints-vince-mcmahons-daughter-as-interim-ceo-amid-probe-11655467082
"Recession Fears Surge Among CEOs, Survey Suggests ",2022-06-17,https://www.wsj.com/articles/recession-fears-surge-among-ceos-survey-suggests-11655458200
The Sommelier Who Put Southern Italy on the Map,2022-06-16,https://www.wsj.com/articles/the-sommelier-who-put-southern-italy-on-the-map-11655403837
Moderna to Study Its Covid-19 Vaccine in Babies as Young as 3 Months ,2022-06-15,https://www.wsj.com/articles/moderna-to-study-its-covid-19-vaccine-in-babies-as-young-as-3-months-11655319036
Health Insurers Reply on ObamaCare Subsidies,2022-06-14,https://www.wsj.com/articles/health-insurance-obama-care-subsidies-premium-cost-competition-11655161307
Kevin Spacey to Appear in U.K. Court on Sexual-Assault Charges,2022-06-13,https://www.wsj.com/articles/kevin-spacey-to-appear-in-u-k-court-this-week-on-sexual-assault-charges-11655144160
Pope Francis’ Canceled Travel Stirs Talk of Retirement,2022-06-12,https://www.wsj.com/articles/pope-franciss-canceled-travel-stirs-talk-of-retirement-11655022477
Online Jeweler Blue Nile to Go Public Via SPAC Acquisition,2022-06-11,https://www.wsj.com/articles/online-jeweler-blue-nile-to-go-public-via-spac-acquisition-11654905937
Whistler’s Unconventional Beauty,2022-06-10,https://www.wsj.com/articles/whistlers-unconventional-beauty-11654883692
The Modern Flush Toilet Has Ancient Origins,2022-06-09,https://www.wsj.com/articles/the-modern-flush-toilet-has-ancient-origins-11654800481
Robinhood Executive Attacks SEC’s Plans to Shake Up Stock-Trading Rules,2022-06-08,https://www.wsj.com/articles/robinhood-executive-attacks-secs-plans-to-shake-up-stock-trading-rules-11654701401
"Russia Is Weaponizing Food Supplies, Europe Says",2022-06-07,https://www.wsj.com/articles/russia-is-weaponizing-food-supplies-in-ukraine-europe-says-11654597039
"Tropical Storm Alex Losing Steam After Wreaking Havoc in Cuba, South Florida",2022-06-06,https://www.wsj.com/articles/tropical-storm-alex-losing-steam-after-wreaking-havoc-in-cuba-south-florida-11654531040
Yellen Says She Never Urged Smaller Rescue Package Over Inflation Concerns ,2022-06-05,https://www.wsj.com/articles/yellen-says-she-never-urged-smaller-rescue-package-over-inflation-concerns-11654386621
LPGA Tour Is Flush With Cash But Still Seeks a Superstar,2022-06-04,https://www.wsj.com/articles/lpga-tour-us-open-nelly-korda-jin-young-ko-11654220279
Retailers Cut Jobs in May With Consumers Facing Inflation,2022-06-03,https://www.wsj.com/articles/retailers-cut-jobs-in-may-with-consumers-facing-inflation-pivoting-to-services-11654272840
How Far Can ‘Shrinkflation’ Go? ,2022-06-02,https://www.wsj.com/articles/how-far-can-shrinkflation-go-11654200907
Binance Raises $500 Million Fund for Crypto Investments,2022-06-01,https://www.wsj.com/articles/binance-raises-500-million-fund-for-crypto-investments-11654107370
"Corporations, Parliament and the New Prosperity",2022-05-31,https://www.wsj.com/articles/corporations-parliament-and-the-new-prosperity-11654012776
Danone to Fly Formula to the U.S. for Babies With Allergies,2022-05-30,https://www.wsj.com/articles/danone-to-fly-formula-to-the-u-s-for-babies-with-allergies-11653907727
U.N. Human-Rights Chief Calls on China to Boost Transparency in Xinjiang ,2022-05-29,https://www.wsj.com/articles/u-n-human-rights-chief-calls-on-china-gently-to-boost-transparency-in-xinjiang-11653756099
Big Tech’s Talent Bonanza,2022-05-28,https://www.wsj.com/articles/the-tech-crash-could-be-a-talent-bonanza-for-big-tech-11653710449
"Baby-Formula Shortage Further Snarled, This Time by War",2022-05-27,https://www.wsj.com/articles/baby-formula-ingredient-supplies-are-limited-by-war-in-ukraine-11653652800
Proposed New Rules Aimed at Curbing Meatpackers’ Power,2022-05-26,https://www.wsj.com/articles/usda-proposes-new-rules-aimed-at-curbing-meatpackers-power-11653573638
What If the Shooter in Buffalo Wasn’t Mentally Ill?,2022-05-25,https://www.wsj.com/articles/buffalo-mass-shooting-shooter-evil-mental-ill-11653430748
Zoom Still Needs the Little People,2022-05-24,https://www.wsj.com/articles/zoom-still-needs-the-little-people-11653415421
The ‘Stakeholder Capitalism’ War on the Enlightenment,2022-05-23,https://www.wsj.com/articles/stakeholder-capitalism-enlightenment-blackrock-esg-index-fund-passive-invest-elizabeth-warren-bernie-sanders-retirement-11653313715
Series I Savings Bonds: What Readers Want to Know,2022-05-22,https://www.wsj.com/articles/series-i-savings-bonds-what-you-should-know-11652834560
New York City Investigates Possible Monkeypox Case,2022-05-21,https://www.wsj.com/articles/new-york-city-investigates-possible-monkeypox-virus-case-amid-outbreak-11653074645
Secret Service Sends Two Employees Home From Biden’s South Korea Visit,2022-05-20,https://www.wsj.com/articles/secret-service-sends-two-employees-home-from-bidens-south-korea-visit-after-alleged-altercation-11653049858
Cisco Rings a Worrisome Bell ,2022-05-19,https://www.wsj.com/articles/cisco-rings-a-worrisome-bell-11652956200
What We Saw in the Early Days of the Jewish Defense League,2022-05-18,https://www.wsj.com/articles/jewish-defense-league-jdl-adl-meir-kahane-book-11652827472
A Lake Como Hotel Where the Past Is Vigorously Maintained,2022-05-17,https://www.wsj.com/articles/lake-como-hotel-tremezzo-11652814342
Railroad Competition Would Reduce Prices,2022-05-16,https://www.wsj.com/articles/railroad-competition-prices-inflation-cost-transport-11652298454
Individual Investors Step Back From Options Bets,2022-05-15,https://www.wsj.com/articles/individual-investors-step-back-from-options-bets-11652549446
New Zealand Prime Minister Ardern Tests Positive for Covid-19 ,2022-05-14,https://www.wsj.com/articles/new-zealand-prime-minister-ardern-tests-positive-for-covid-19-11652484656
"Noonan, Roe and the Lasting Questions of Abortion",2022-05-13,https://www.wsj.com/articles/peggy-noonan-roe-v-wade-abortion-dobbs-alito-life-choice-11652396985
"Rising Diesel Costs Are Straining U.S. Truckers, Shipping Operations ",2022-05-12,https://www.wsj.com/articles/rising-diesel-costs-are-straining-u-s-truckers-shipping-operations-11652376035
Burial Sites for Native American Kids Found at 53 Boarding Schools ,2022-05-11,https://www.wsj.com/articles/burial-sites-found-at-53-schools-for-native-american-kids-11652284800
Who Said What About Roe to Congress?,2022-05-10,https://www.wsj.com/articles/letters-who-said-what-about-roe-to-congress-11652200953
A Real-Estate Investor’s Art-Filled New York Co-op Asks $17.7 Million—Picassos Not Included,2022-05-09,https://www.wsj.com/articles/a-real-estate-investors-art-filled-park-avenue-co-op-asks-17-7-millionpicassos-not-included-11652118617
"Billion-Dollar Crypto Loan Easy to Get, Gone in a Flash",2022-05-08,https://www.wsj.com/articles/this-billion-dollar-crypto-loan-is-easy-to-get-but-gone-in-a-flash-11651985089
Judge Dismisses Trump Suit Against Twitter Over Censorship Claims,2022-05-07,https://www.wsj.com/articles/judge-dismisses-trump-suit-against-twitter-over-censorship-claims-11651882400
America Has Forgotten Its Liberalism,2022-05-06,https://www.wsj.com/articles/liberalism-classical-conservative-america-principles-great-11651786941
The Gopuff Co-CEO on What Will Work—and What Won’t—in the Sprint for Fast Delivery,2022-05-05,https://www.wsj.com/articles/gopuffs-co-ceo-on-what-will-workand-what-wontin-the-sprint-for-quick-delivery-11651762617
The Trial of Johnny Depp and Amber Heard: What to Know So Far,2022-05-04,https://www.wsj.com/articles/johnny-depp-amber-heard-defamation-trial-11651692481
"U.S. Job Openings, Total Quits Reach Records",2022-05-03,https://www.wsj.com/articles/job-openings-us-growth-labor-market-turnover-march-2022-11651529531
EU Prepares Ban on Russian Oil ,2022-05-02,https://www.wsj.com/articles/germany-calls-for-russian-oil-embargo-as-eu-prepares-new-sanctions-11651488395
"Naomi Judd, of Grammy-Winning Duo the Judds, Dies at 76",2022-05-01,https://www.wsj.com/articles/naomi-judd-of-grammy-winning-duo-the-judds-dies-at-76-11651352342
Activision CEO Could Walk Away With Over $500 Million After Microsoft Deal ,2022-04-30,https://www.wsj.com/articles/activision-blizzard-ceo-bobby-kotick-could-walk-away-with-more-than-500-million-after-microsoft-deal-11651284218
Presentation Is the Least of Biden’s Problems,2022-04-29,https://www.wsj.com/articles/joe-biden-peggy-noonan-presentation-cognitive-ability-decline-speech-11651185597
Biden Nears Decision on Canceling Some Student-Loan Debt,2022-04-28,https://www.wsj.com/articles/biden-says-he-is-considering-canceling-some-student-loan-debt-11651161126
Trevor Reed Released in Russian Prisoner Swap ,2022-04-27,https://www.wsj.com/articles/u-s-citizen-trevor-reed-released-in-russian-prisoner-swap-11651066793
Kevin Hart’s Media Empire Expands With $100 Million Private-Equity Investment,2022-04-26,https://www.wsj.com/articles/kevin-harts-media-empire-expands-with-100-million-private-equity-investment-11650987826
Countries Ramp Up Rules Regarding ESG Disclosure,2022-04-25,https://www.wsj.com/articles/countries-ramp-up-rules-regarding-esg-disclosure-11650900505
Japanese Yen’s Drop Raises Potential for Broader Market Trouble,2022-04-24,https://www.wsj.com/articles/japanese-yens-drop-raises-potential-for-broader-market-trouble-11650726762
Trump Says McCarthy Relationship Not Damaged,2022-04-23,https://www.wsj.com/articles/mccarthy-said-he-would-advise-trump-to-resign-after-jan-6-riot-tape-shows-11650637401
Verizon Loses Subscribers and Warns of Inflation’s Toll ,2022-04-22,https://www.wsj.com/articles/verizon-loses-subscribers-and-warns-of-inflations-toll-11650646419
Three Things Marketers Should Know About Netflix’s Possible Foray into Ads,2022-04-21,https://www.wsj.com/articles/three-things-marketers-should-know-about-netflixs-possible-foray-into-ads-11650568334
"Arab Incitement to Violence Against Jews, Then and Now",2022-04-20,https://www.wsj.com/articles/palestinian-israel-terrorism-jews-arab-incitement-abbas-11650399584
‘Green Inflation’ Is Nothing New. But More Is On the Way,2022-04-19,https://www.wsj.com/articles/green-inflation-energy-renewable-subsidy-electricity-11650318920
"From the Sages of the Mishnah to ‘America the Beautiful,’ a Lesson in Liberty",2022-04-18,https://www.wsj.com/articles/liberty-order-passover-jewish-shavuot-america-the-beautiful-11650037073
Meet the Twitter Army of Elon Musk Superfans ,2022-04-17,https://www.wsj.com/articles/meet-the-twitter-army-of-elon-musk-superfans-11650137427
First Criminal Wage-Fixing Trials End in Loss for DOJ,2022-04-16,https://www.wsj.com/articles/first-criminal-wage-fixing-trial-ends-in-loss-for-justice-department-11650047840
A Ukrainian City Thwarts Russian Plans to Control the Black Sea Rim ,2022-04-15,https://www.wsj.com/articles/a-ukrainian-city-thwarts-russian-plans-to-control-the-black-sea-rim-11650035932
The Best Easter Recipes for Every Kind of Feast,2022-04-14,https://www.wsj.com/articles/best-easter-recipes-2022-11649963811
Roman Abramovich Asset Freeze Extends to $7 Billion in Jersey and a French Chateau,2022-04-13,https://www.wsj.com/articles/roman-abramovich-asset-freeze-extends-to-7-billion-in-jersey-and-a-french-chateau-11649869040
Viktor Orbán and the Budapest Option,2022-04-12,https://www.wsj.com/articles/hungary-budapest-viktor-orban-conservative-dreher-europe-eu-11649716947
Wooden Skyscrapers Are on the Rise,2022-04-11,https://www.wsj.com/articles/wooden-skyscrapers-are-on-the-rise-11649693924
Six Reasons Why Stocks Are Rallying  ,2022-04-10,https://www.wsj.com/articles/why-stocks-are-rallying-in-the-midst-of-a-war-and-soaring-inflation-11649547410
The Future of Socializing at Work? Virtual Golf.,2022-04-09,https://www.wsj.com/articles/the-future-of-socializing-at-work-virtual-golf-11649476854
Nothing Like an SAT Score to Prove a College Counselor Wrong,2022-04-08,https://www.wsj.com/articles/sat-act-standardized-test-college-admissions-counselor-mit-11649358985
"Frontline, Euronav Merge to Create Tanker Giant in $4.2 Billion Stock Deal",2022-04-07,https://www.wsj.com/articles/frontline-and-euronav-merge-to-create-tanker-giant-in-4-2-billion-stock-deal-11649332189
Deaths at Shanghai Elderly Facility Spark a Dispute Over Cremation ,2022-04-06,https://www.wsj.com/articles/deaths-at-shanghai-elderly-facility-spark-a-dispute-over-cremation-11649262740
The Earnings Squeeze Is Here,2022-04-05,https://www.wsj.com/articles/the-earnings-squeeze-is-here-11649179062
Ask Biden: Do the Words of a President Still Matter?,2022-04-04,https://www.wsj.com/articles/biden-trump-words-matter-gaffe-11649012052
"In Shanghai, Strict Covid Rules Separate Children From Parents ",2022-04-03,https://www.wsj.com/articles/in-shanghai-strict-covid-rules-separate-children-from-parents-11648961849
"Ukraine Strikes Inside Russian Territory, Russians Say",2022-04-02,https://www.wsj.com/articles/ukraine-strikes-russian-military-depot-russians-say-11648804107
What Kids Learn From Stock-Picking Games,2022-04-01,https://www.wsj.com/articles/stock-picking-game-simulation-market-education-11648826833
Donors Pledge $2.44 Billion in Aid to Afghanistan,2022-03-31,https://www.wsj.com/articles/donors-pledge-2-44-billion-in-aid-to-hunger-stricken-afghanistan-11648754590
International Order Is on the Line in Ukraine,2022-03-30,https://www.wsj.com/articles/the-liberal-international-order-ukraine-russia-invasion-war-xi-putin-taiwan-china-peace-talks-turkey-defense-spending-budget-negotiations-global-power-11648660753
Home-Price Growth Accelerated in January,2022-03-29,https://www.wsj.com/articles/home-price-growth-accelerated-in-january-11648558827
"Law Students, Their Teachers and Our Future",2022-03-28,https://www.wsj.com/articles/law-school-yale-free-speech-campus-silberman-lawyers-11648404822
"Pfizer, Moderna and J&J Face Shareholder Pressure to Broaden Vaccine Access ",2022-03-27,https://www.wsj.com/articles/pfizer-moderna-and-j-j-face-shareholder-pressure-to-broaden-covid-19-vaccine-access-11648373402
Would Saint Peter’s University Make WSJ’s Sweet 16 of Affordability?,2022-03-26,https://www.wsj.com/articles/ncaa-saint-peters-university-march-madness-affordability-11648150797
Make Money Off Your Closet: What Clothing to Sell Now and Later,2022-03-25,https://www.wsj.com/articles/clothing-resale-value-11648228056
"New York City Won’t Rehire Unvaccinated Workers Who Were Fired, Mayor Says",2022-03-24,https://www.wsj.com/articles/new-york-city-wont-rehire-unvaccinated-workers-who-were-fired-mayor-says-11648151990
A Florida Keys Home With Four Tiki Huts Lists for $23 Million,2022-03-23,https://www.wsj.com/articles/islamorada-florida-keys-home-asks-23-million-11648056878
"This Utah Couple Packed Their Retirement Home With Amenities to Get Their Kids to Visit. ‘So Far, It’s Working.’",2022-03-22,https://www.wsj.com/articles/park-city-utah-retirement-home-11647968418
Russian Oligarchs’ Yachts Hit the High Seas,2022-03-21,https://www.wsj.com/articles/russian-oligarchs-yachts-hit-the-high-seas-11647876326
"M.B.A.s’ Latest Pitch to Investors: Forget the Startup, Invest in Me",2022-03-20,https://www.wsj.com/articles/m-b-a-s-latest-pitch-investors-startup-business-school-spac-11647457255
"Apple, Delta, Lyft: Stocks That Defined the Week",2022-03-19,https://www.wsj.com/articles/apple-delta-lyft-stocks-that-defined-the-week-11647648140
The People’s Champion,2022-03-18,https://www.wsj.com/articles/the-peoples-champion-11647620766
2022 Jeep Wagoneer’s Massive Appeal,2022-03-17,https://www.wsj.com/articles/2022-jeep-wagoneer-massive-appeal-11647542373
"The Censor, the Bureaucrat and the Fed Economist",2022-03-16,https://www.wsj.com/articles/fed-federal-reserve-economist-liberal-democrat-bias-bureaucracy-11647377311
Los Angeles Mansion Sells for $37 Million to Former Meta Executive David Marcus,2022-03-15,https://www.wsj.com/articles/los-angeles-mansion-sells-for-37-million-to-former-meta-executive-david-marcus-11647369839
